302; 714; Z raportu tego można się np. dowiedzieć, że klient wyszukiwał hasła „najlepsze miejsce do wysyłania kwiatów” i „wysyłanie kwiatów koszalin”.; For example, this report shows that a customer searched for "best place to send flowers through" and "send flowers idaho falls."
303; 726; Poluzuj kołnierz.; Loosen your collar.
304; 734; Jest to pytanie, które zadaję sobie zarówno ja, jak i moje koło parlamentarne.; That is what I and my political group are asking, but I should like to have more details concerning the Commission's position on this point.
305; 737; Poproszono mnie także o to, abym opuścił stowarzyszenie - stowarzyszenie artystów karykatury w Ameryce - które było dla mnie jak koło ratunkowe.; I was also asked to leave the organization, a cartoonists' organization in America, that for me was my lifeline.
306; 739; Takie dwutorowe podejście jest jedynym możliwym, jeżeli chcemy stworzyć koło sukcesu, które doprowadzi do stabilnej demokracji w tym kraju oraz w sąsiedztwie wschodnim.; This two-track approach is the only one possible if we want to create a virtuous circle that could lead to democratic stability in this country and in the Eastern neighbourhood.
307; 741; Brak przemocy działa jak koło zamachowe.; Now nonviolence starts to work like a flywheel.
308; 743; kończyć się ostrzeżeniem; to end on a cautionary note
309; 747; Preferencje handlowe przyznano na okres kończący się 31 grudnia 2010 r.; These trade preferences were granted for a period ending on 31 December 2010.
310; 752; Jeśli chodzi o wciąganie na tę listę prawników, co obecnie stanowi główną kość niezgody, popieram wpisywanie ich do obowiązkowego rejestru.; On the issue of including lawyers on the list, which is currently the main bone of contention, I favour inclusion in a mandatory register.
311; 756; Biorąc pod uwagę kierunek zmian klimatycznych, obawiam się, że jedynym miejscem, w którym będziemy mieć zimą śnieg w przyszłości, jest Laponia.; The way in which climate change is going, I am afraid the only place where we are going to have snow in the winter in the future is going to be Lapland.
312; 758; Zrobiła to podczas programu Larry King Live w CNN, sześć i pół roku temu.; She did this on the "Larry King Live" show on CNN six and a half years ago.
313; 760; Biali, Czarni, Latynosi, Azjaci.; It's white, black, Hispanic, Asian.
314; 761; Lawrence powiedział, no nie, że będzie miał ze sobą..... transport prochów, no nie?; Lawrence says, right, he's going to be carrying..... a load of drugs, right?
315; 767; Od Lascaux, przez Luwr, aż do Carnegie Hall, ludzie gustują niezmiennie w przedstawieniach, które wymagają umiejętności.; From Lascaux to the Louvre to Carnegie Hall, human beings have a permanent innate taste for virtuoso displays in the arts.
316; 769; Wino można wypić, a łąka pozostaje.; You never run out of that companion as you drink this wine, too.
317; 773; Szacuje się, że do 2050 roku podwoi się liczba mieszkańców miast.; By 2050, it's estimated that twice the number of us are going to be living in cities.
318; 783; Ze względu na niewielką liczebność próby, różnica między wynikami w tych randomizowanych podgrupach mogła być przypadkowa.; The difference in results between these randomisation subgroups may have arisen by chance in view of their limited sample size.
319; 784; Laboratoryjnymi cechami diagnostycznymi są: obniżone pH krwi, poziomy mleczanów w osoczu powyżej 5 mmol/ l i zwiększona luka anionowa oraz stosunek mleczan/ pirogronian.; Diagnostic laboratory findings are decreased blood pH, plasma lactate levels above 5mmol/ l, and an increased anion gap and lactate/ pyruvate ratio.
320; 788; Był Prozac, był Zoloft, to była lukrecja, a to środki zwiotczające mięśnie.; So this was Prozac, this was Zoloft, this was a black jellybean and this was muscle relaxant, all of which were the medications that the impatient was taking.
321; 790; Dlatego też planowym miejscem demonstracji był Plac Luksemburski, który znajduje się tuż obok wejścia do gmachu Parlamentu.; That is why the appointed place was Luxemburgplein right next to the entrance to Parliament.
322; 806; Do jego odczytania potrzebna jest lupa.; You will need a magnifying glass to see it.
323; 810; A odchodząc stamtąd Jezus, ujrzał człowieka siedzącego na cle, którego zwano Mateusz, i rzekł mu: Pójdź za mną; tedy wstawszy, szedł za nim.; And as Jesus passed by from thence, he saw a man, called Matthew, sitting at the place of toll: and he saith unto him, Follow me.
324; 811; Matka Boska Częstochowska; Black Madonna of Częstochowa
325; 814; I w ten sposób wiemy na pewno, że to rzeczywiście był Mikołaj Kopernik.; The DNA matched, and we know that this was indeed Nicolaus Copernicus.
326; 815; Przecież są niewiarygodnie małe, musicie mieć mikroskop żeby je zobaczyć.; I mean they're incredibly small, you have to have a microscope to see one.
327; 820; Rząd meksykański posiada także specjalnego doradcę ds. praw człowieka, kolejną panią, która także szczególnie zajmuje się tą kwestią.; They have also a special human rights adviser, another lady who is also working particularly on this issue.
328; 821; Jeżeli dobrze rozumiemy, co mówią nam Europejczycy, nie wolno nam, Panie i Panowie, pozwolić, aby rocznica ta miała charakter nostalgiczny lub melancholijny.; If we understand rightly what Europeans are saying to us, we have no right, honourable Members, to allow this anniversary to be a nostalgic or melancholic one.
329; 825; Z tego względu nie zaleca się karmienia piersią przez kobiety leczone melatoniną.; Therefore, breast-feeding is not recommended in women under treatment with melatonin.
330; 830; Więc staram się połączyć tą przestrzeń między tym pomysłem, a tą melodią.; So I'm trying to bridge this gap between this idea and this melody.
331; 836; Metalowy pojemnik zawiera zawiesinę pod ciśnieniem.; The metal can contains a pressurised liquid.
332; 840; Metan ulatniający się z kału zwierzęcego jest także odnawialnym źródłem energii.; Methane from animal faeces is also a renewable source of energy.
333; 842; metaplik z grafiką komputerową; Computer Graphics Metafile
334; 858; Jako mnich buddyjski po obiedzie nie spożywam już innych posiłków.; In my case, as a Buddhist monk, after lunch I have no more meals.
335; 859; Martwi mnie fakt, że często większą uwagę przywiązujemy do ilości niż do jakości.; I am rather worried that we tend to pay more attention to quantity than quality.
336; 860; mnie również miło poznać; it's nice to meet you too
337; 861; - (HU) Komisja Europejska określiła mandaty negocjacyjne mniej więcej 11 lat temu.; - (HU) The European Commission defined the negotiating mandates some 11 years ago.
338; 863; To jest "tura pytań” i odpowiedź "tak” lub "nie” byłaby bardziej stosowna, ale mniejsza z tym.; It is Question Time, and a 'yes' or a 'no' would have been easier, but never mind.
339; 864; Ostatecznie możemy jedynie spróbować wybrać mniejsze zło.; Ultimately, this is a choice between the devil and the deep-blue sea.
340; 865; W ramach tego projektu robi też mniejszy projekt o nazwie "Domowi artyści".; And within this project, he's doing a smaller project called "Artists in Residence."
341; 866; Tak naprawdę, jest to kolejne zaściankowe, błędne mniemanie.; Now actually, that's just another parochial misconception.
342; 867; Mnisi, którzy schronili się w pobliskiej świątyni Phuoc Hue, zostali pobici.; The monks who sought refuge in the nearby Phuoc Hue temple were beaten up.
343; 868; Jest 69 letnią mniszką.; She is a 69-year-old nun.
344; 869; To zrozumiałe w dobie kryzysu, lecz czyż nie powinniśmy mobilizować również innych instrumentów?; This is understandable in a time of crisis, but should we not be mobilising other instruments, as well?
345; 871; Złoży się na nią większa mobilność studentów, badaczy naukowych i wykładowców.; Greater mobility of students, researchers and lecturers will contribute to this.
346; 872; Dobrobyt gospodarczy i lepsza wertykalna mobilność społeczna są kluczem do skutecznej polityki migracyjnej.; Economic welfare and greater upward social mobility are the key to a successful migration policy.
347; 873; Obecnie nakazy ochrony tracą moc na granicy kraju, pozostawiając ofiarę bezbronną.; At present, protection orders stop at our border, leaving the victim defenceless.
348; 874; model referencyjny połączen systemów otwartych; Open System Interconnection
349; 876; W chwili obecnej nie istnieje jednak model zwierzęcy pozwalający na zbadanie SUD.; However, there was currently no animal model available to investigate SUDs.
350; 878; Jednak wygląda na to, że bardziej interesuje go była modelka niż liberalizacja gospodarki.; Yet it seems that he is more concerned with a retired fashion model than liberalising the economy.
351; 879; Modelowanie: po prawej stronie znajduje się złożony model obliczeniowy.; Modeling: on the right hand side, there's a very complex computational model.
352; 880; Jedynym sposobem znanym matematykom, by modelować tę strukturę, jest szydełkowanie.; And the only way that mathematicians know how to model this structure is with crochet.
353; 883; Narodowa Fundacja na rzecz Nauki czy inne kraje też się tym interesują.; The National Science Foundation, other countries are very interested in doing this.
354; 885; To właśnie takie kraje jak Nigeria są w sytuacji gorszej niż gdyby nigdy ropy nie mieli.; It's countries like Nigeria, which are worse off than if they'd never had oil.
355; 886; Nikaragua pozostaje jednym z najbiedniejszych krajów Ameryki.; Mr President, Nicaragua remains one of the poorest countries in the Americas.
356; 889; Tak samo nie możemy zapomnieć o spornych regionach An-Nil al-Azraku i Południowego Kordofanu z górami Nuba.; Similarly, we must not forget the equally disputed regions of Blue Nile and South Kordofan with the Nuba mountains.
357; 890; W niektóre lata zimna woda dociera aż do Brazylii, a w inne, gdy pojawia się La Niña, nie dociera.; Some years, the cold water goes all the way up to Brazil, and other years, in these La Nina years, it doesn't.
358; 892; Schwarz Pharma Deutschland GmbH Alfred- Nobel- Str.; Germany Schwarz Pharma Deutschland GmbH Alfred-Nobel-Str.
359; 893; Noc żywych trupów; Night of the Living Dead
360; 895; Jest to środek na bazie wody.; It is a water-based alternative.
361; 896; Dlatego też musimy być na bieżąco z tym, co dzieje się w Stanach Zjednoczonych.; We must therefore stay up-to-date with developments in the United States.
362; 897; Odłóżcie na bok swoje obawy i teoretyczne debaty.; Commissioner, ladies and gentlemen, put away your fears and theoretical debates.
363; 898; Po drugie, rozmawiając na temat umów energetycznych nigdy nie dobijamy żadnych interesów na boku.; Secondly, we never make any side deals when we are discussing energy agreements.
364; 899; na całe gardło; at the top of one's voice
365; 900; • wspieraniu budowy instytucji państwowych, działających na terenie całego kraju.; • support in building State institutions active throughout the country.
366; 901; Po podaniu zewnętrznym u kota, na szyję u podstawy czaszki, metaflumizon jest szybko dystrybuowany na całej powierzchni skóry.; After topical administration at a single site on the cat's neck at the base of the skull, metaflumizone is rapidly distributed throughout the surface of the skin.
367; 902; na cały głos; at the top of one's voice
368; 903; Do objawów tych należą: wysypka na całym ciele, spłycenie oddechu, świszczący oddech, obniżenie ciśnienia tętniczego krwi, przyspieszone tętno i poty.; It may cause a rash over the whole body, shortness of breath, wheezing, reduction in blood pressure, fast pulse, or sweating.
369; 904; Ponadto w ostatnich latach liczba przypadków zwolnień z pracy pracowników przebywających na zwolnieniu chorobowym lub zwolnieniu będącym następstwem wypadku przy pracy wzrosła.; In addition, in recent years, the number of cases in which employees have been dismissed while on sick leave or following an accident at work has risen.
370; 905; Nie mamy czasu do stracenia - nie należy zostawiać wszystkiego na ostatnią chwilę.; We have no time to lose - we should not leave everything to the last minute.
371; 907; Pokazuję wam Pernoda, bo - to tylko jeden przykład - każdy kraj ma swój kontekstowy napój alkoholowy.; Now, the reason I show you Pernod -- it's only one example. ~~~ Every country has a contextual alcoholic drink.
372; 908; Jest to najstarszy napój energetyczny na świecie i wyjątkowo ważny produkt, dlatego cieszę się, że jest tematem dzisiejszej debaty.; Milk is the oldest energy drink in the world, it is a particularly important product, and it is good that we are debating it today.
373; 911; Oczywiście, musimy naradzić się co do odbudowy, ale musimy także naradzić się w sprawie rozwiązania konfliktu.; Of course we must have a conference on reconstruction, but we must also have a conference to resolve the conflict.
374; 912; Kilka dni temu Przewodniczący Barroso przestrzegał Europę przed narastającą falą populizmu i nacjonalizmu.; (BG) Mr President, a few days ago, President Barroso warned that Europe is facing a rising wave of populism and nationalism.
375; 913; Na wyższych częstotliwościach linie obrazują narastający hałas fal i wiatru.; Up high, these variable lines indicate increasing noise in this frequency range from higher wind and wave.
376; 914; Już teraz jest to niebagatelna liczba, a oczywiście zjawisko to będzie narastać.; That is already a considerable number and, clearly, it is a phenomenon that will increase.
377; 915; Możesz wybrać do przesłania pojedyncze pliki lub wiele plików naraz:.; You can select one or more files or Google Docs to download to your computer:
378; 916; których stan zmniejszonej uwagi moż narazić lub inne osoby na ryzyko obraż lub ś; Any unused product or waste material should be disposed of in accordance with local requirements
379; 918; Nie można narażać na niebezpieczeństwo polityki klimatycznej naszych partnerów handlowych, aby zwiększyć udział Europy w rynku.; Our trade partners' climate policies cannot be jeopardised in order to boost Europe's market share.
380; 921; Każdy, kto lubi narciarstwo, jak ja, wie, że w tym regionie, po południu, około godziny 15.00, zagrożenie hałasem wydaje się większym problemem niż szkody powstałe w środowisku naturalnym.; Anyone who enjoys skiing, as I do, will know that at around 15:00 in the afternoon in this region, noise pollution seems to be a bigger problem than damage to the natural environment.
381; 925; Potem jest design narcystyczny: to fantastyczny designer, który projektuje tylko dla innych fantastycznych designerów.; After, there is the narcissistic design: it's a fantastic designer who designs only for other fantastic designers.
382; 928; Narkomani odnajdują żyły w palcach u nóg, gdy pękają im żyły w nogach i ramionach.; Junkies find veins in their toes when the ones in their arms and their legs collapse.
383; 930; Alkohol często spożywany jest z narkotykami lub sam w sobie traktowany jest jako narkotyk.; Alcohol is often taken with drugs or alcohol itself may end up as a drug.
384; 931; Uprawiane i produkowane w Afganistanie narkotyki trafiają na europejskie ulice.; Drugs grown and produced in Afghanistan find their way to the streets of Europe.
385; 932; Pierwszy z nich Jacques Cousteau nazwał "zachwytem głębią" To narkoza azotowa.; One of them is what Jacques Cousteau called "rapture of the deep."
386; 935; narobić komuś obciachu; to come down on sb
387; 936; Nie ma on nigdy zastąpić budżetów krajowych reprezentujących suwerenność narodową.; It never substitutes the national budgets representing national sovereignty.
388; 939; W życiu codziennym ludzi nie ma sporów i nie istnieje problem narodowościowy na terytoriach o mieszanej ludności.; In people's everyday lives, there are no disputes and there is no nationality problem in mixed areas.
389; 941; Estonia obchodzi 14 czerwca Narodowy Dzień Pamięci.; In Estonia, 14 June is a national day of commemoration.
390; 942; Lecz niedługo potem uderzył na nie wiatr gwałtowny, który zowią Euroklidon.; But after no long time there beat down from it a tempestuous wind, which is called Euraquilo:
391; 943; Nikt nie chce być wobec niego niegrzeczny ani czuć się winny, więc pomyślałem, że to się nada bez ruszania się z miejsca.; You know, you don't want to be rude to him and you don't want to feel guilty, and so I thought this would do it, where I just sit here.
392; 946; I widziałem niejeden niesamowity występ z rodzaju tych "na rozgrzewkę".; And I've had some incredible warm-up acts.
393; 947; Bez strefy euro przezwyciężenie kryzysu przebiegałoby dużo wolniej i w bardziej niejednolity sposób.; Without the functioning eurozone, overcoming the crisis would have been much slower and uneven.
394; 948; To sektor bardzo niejednorodny - obejmuje on różne typy funduszy, profile ryzyka i strategie inwestycyjne.; This is a very heterogeneous sector having various different types of funds, risk profiles and also investment strategies.
395; 949; Jesteśmy przekonani, że rząd węgierski nie pozostawi tu miejsca na niejednoznaczność.; We are confident that the Hungarian Government will leave no room for ambiguity there.
396; 954; Widocznie, w tej sferze szczyt G20 okazał się niekompetentny.; Clearly, in this respect, the G20 was incompetent.
397; 957; Nakazy aresztowania wydaje się w przypadkach, w których są one niekonieczne i niewspółmierne.; Warrants have been issued when their use was both unnecessary and disproportionate.
398; 960; Rosyjskie władze zdecydowanie wdrażają niekonstytucyjny porządek prawny.; The Russian authorities are evidently implementing unconstitutional law and order.
399; 965; Jednoczesne stosowanie tych leków z lekiem Vivanza może bardzo niekorzystnie wpłynąć na ciśnienie tętnicze krwi.; Taking these medicines with Vivanza could seriously affect your blood pressure.
400; 966; W świetle prawa UE wszelkie działania na Twoją niekorzyść są nielegalne.; If there are any adverse effects, these are illegal under EU law.
401; 967; Wydaje się, że Norweski Fundusz Ropy Naftowej jest przykładem, o którym wspominano już w tej debacie.; The Norwegian Oil Fund is, I think, an example which has been mentioned in this debate.
402; 968; leku Oprymea po upływie terminu waż ci zamieszczonego na opakowaniu. noś; Do not use Oprymea after the expiry date which is stated on the packaging.
403; 969; Ja i moi współpracownicy, Brian Nosek i Jesse Graham stworzyliśmy kwestionariusz - jest w sieci na www.YourMorals.org; And my colleagues, Brian Nosek and Jesse Graham, and I, made a questionnaire, which we put up on the Web at www.YourMorals.org.
404; 970; Ale jeśli nosiciel musi być w pełni sił, żeby przekazać patogen, wtedy te łagodne zostają zwycięzcami.; But if the host needs to be mobile in order to transmit the pathogen, then it's the benign ones that tend to be the winners.
405; 971; Zmniejszenie nawrotów raka przez lek który nawet nie oddziałuje na nowotwór.; Reduce occurrence of cancer by a drug that doesn't even touch the cancer.
406; 972; nowotwór olbrzymiokomórkowy kości; giant-cell tumor of the bone
407; 973; Ale pytanie brzmi: czy przebaczenie i odkupienie zastępuje sprawiedliwość?; But the question is, does forgiveness and redemption replace justice?
408; 974; Dlaczego miałbyś kupować odtwarzacz MP3 od firmy komputerowej?; Why would you buy an MP3 player from a computer company?
409; 975; Wszyscy widzieliśmy film "2001: Odyseja kosmiczna" Teraz jest rok 2003. ~~~ I nie ma HAL'a.; You know it's 2003, and there is no HAL.
410; 976; Czy mógłbyś przyjechać do Ohio z tym mężczyzną, z którym teraz żyjesz?; Could you please come to Ohio, and please bring that man that I know you have found by now.
411; 978; Bombardowanie Oklahoma City było prostą technologią, użytą w potworny sposób.; The Oklahoma City bombing was simple technology, horribly used.
412; 988; Immunomedics GmbH Otto- Röhm- Straße 69 D- 64293 Darmstadt Niemcy; Immunomedics GmbH Otto-Röhm-Straße 69 D-64293 Darmstadt Germany
413; 990; Badanie pokazało, że 90% Szwedów nigdy nie słyszało o gułagach, podczas gdy 95% z nich wie, czym był Oświęcim.; A study showed that 90% of Swedes have never heard of the gulags, while 95% knew what Auschwitz was.
414; 991; Zastępy twoje mieszkają w niem, któreś ty dla ubogiego nagotował dobrocią twoją, o Boże; The Lord giveth the word: The women that publish the tidings are a great host.
415; 994; Przeprowadziliśmy operację, moja kompania przeprowadziła atak o brzasku -- wiecie, klasyczny atak o świcie: przygotowujesz się całą noc, zajmujesz pozycję wyjściową do natarcia.; And we did an operation, and my company did a dawn attack -- you know, the classic dawn attack: you prepare all night, move to the line of departure.
416; 997; Pewnie powiecie "Hej, o co ci chodzi.; I have one climate crisis; I don't really need the second one."
417; 998; O mało nie umarła.; She nearly died.
418; 999; A ja na to: "O, mój Boże, to będzie okropne."; And I said, "Oh my God, this is going to suck."
419; 1000; Czy Komisja wie o negatywnym wpływie umowy na konkurencyjność europejską oraz na zatrudnienie w przemyśle motoryzacyjnym i włókienniczym?; Does the Commission have any awareness of the negative impact of the agreement on European competitiveness and on employment in the automobile and textile industries?
420; 1001; Teraz, żeby odnieść sukces należy myśleć o przyszłych pokoleniach, nie na odwrót.; To be successful now, you have to think about future generations, not vice versa.
421; 1003; Najsilniej dotyka osób o niskich dochodach, które spożywają więcej cukru i nasyconych tłuszczów.; People on low incomes are worst affected since they consume more sugar and saturated fats.
422; 1004; Dla mnie jest to określenie mylące i wolałbym inne, na przykład "statki o niskim standardzie”.; For me, that is a misnomer and I would have preferred something like 'substandard' ships.
423; 1006; choroby lub u pacjentów o obniżonej odporności, u których przewiduje się słabą odpowiedź na leczenie miejscowe.; immunocompromised, in whom response to topical therapy is expected to be poor.
424; 1007; o ograniczonych dochodach; on a budget
425; 1011; Japonia jest światowym partnerem o podobnych zapatrywaniach, który współpracuje z nami podczas wielostronnych forów w dążeniu do lepszego przestrzegania oraz lepszej ochrony praw człowieka.; Japan is a like-minded global player cooperating constructively with us in multilateral forums in order to improve respect for and protection of human rights.
426; 1014; Norwegia znana jest z pięknej przyrody, fiordów, gór i słońca o północy.; Norway is known for its beautiful nature, fjords, mountains and the midnight sun.
427; 1017; odkładać do leżakowania; to lay down
428; 1018; odkładać na czarną godzinę; to save sth for a rainy day
429; 1019; Jak widzicie, kompletne odludzie.; As you can see, if that's nowhere, it's in the middle of it.
430; 1023; Nie chcę odmalowywać czarnego scenariusza, jak to już tutaj robiono.; Mr President, I do not want to depict a doom scenario, as has been done here.
431; 1024; Byłoby głupotą odmawiać sobie tego, na co inni reagują z radością i przyjaźnią.; We would be foolish to deny ourselves what others recognise with friendship and with joy.
432; 1026; Byłoby głupotą odmawiać sobie tego, na co inni reagują z radością i przyjaźnią.; We would be foolish to deny ourselves what others recognise with friendship and with joy.
433; 1027; Po wszystkie dni wymierzonego czasu mego będę oczekiwał przyszłej odmiany mojej.; All the days of my warfare would I wait, Till my release should come.
434; 1030; Nie czekajcie, aż zarobicie pierwszy milion żeby odmienić czyjeś życie.; Don't wait until you make your first million to make a difference in somebody's life.
435; 1031; odmienne podejście naukowe; different scientific approach
436; 1032; Następnie mamy nową politykę sąsiedztwa - odmienny poziom ambicji i wizję.; Then, there is the new Neighbourhood Policy - a different level of ambition and vision.
437; 1033; Używając miarki odmierzyć kolejne 23 ml wody i dodać do butelki.; Using the cup measure another 23 ml of water and add this to the bottle.
438; 1036; Odmowa takiej pomocy byłaby podła, niekonsekwentna, pełna hipokryzji i bezcelowa.; Not to tender it would be mean, inconsistent, hypocritical and self-defeating.
439; 1037; odmowa ssania piersi; refusal to nurse
440; 1038; na złość babci odmrozić sobie uszy; to cut off one’s nose to spite one’s face
441; 1039; Iracki rząd powinien odmówić wypełniania rozkazów teherańskich mułłów.; The Iraqi Government should stop following the orders of the Mullahs in Tehran.
442; 1041; Pola elektromagnetyczne (PEM) są przedmiotem bezpośrednich obaw obywateli UE.; Electromagnetic fields (EMF) are a matter of direct concern to EU citizens.
443; 1042; Jeśli w wynikach wyszukiwania Google znajdziesz stronę, która zawiera Twoje dane osobowe, takie jak numer PESEL lub numer karty kredytowej, powiadom nas o tym za pomocą poniższych linków.; If you find a page in Google search results that lists personal information such as your social security or credit card number, let us know using the links below.
