Id; WordId; Source; Translation
0; 1; Jest to zwiększenie średnio 1, 5 - do - 2- krotne, co związane jest z 1, 5- krotnym zwiększeniem stężenia AGP w osoczu, który jest białkiem silnie wiążącym imatynib.; The increase is approximately 1.5- to 2-fold, corresponding to a 1.5-fold elevation of plasma AGP, to which imatinib binds strongly.
1; 2; Być może Ben Zander i Bill Gates mogliby się dogadać i stworzyć operę o AIDS.; Perhaps Ben Zander and Bill Gates could get together and make an opera about AIDS.
2; 3; blister (Aclar / PCW/ alu) w zewnętrznym opakowaniu tekturowym uszczelnionym na gorąco; Film-coated tablet Film-coated tablet Film-coated tablet Film-coated tablet Film-coated tablet
3; 4; standard wyświetlania ANSI; ANSI screen control
4; 5; Pacjentów z APL zazwyczaj leczy się retinoidami (substancjami będącymi pochodnymi witaminy A).; Patients with APL are normally treated with retinoids (substances derived from vitamin A).
5; 6; Produkt ten można stosować jako element strategii leczenia Alergicznego Pchlego Zapalenia Skóry (APZS).; The veterinary medicinal product can be used as part of a treatment strategy for the control of Flea Allergy Dermatitis (FAD).
6; 9; Akt Unii z 1707; Acts of Union in 1707
7; 11; Eisai Manufacturing Limited Mosquito Way Hatfield Herts AL10 9SN Wielka Brytania; Eisai Manufacturing Limited Mosquito Way Hatfield Herts AL10 9SN United Kingdom
8; 13; Mój stan, Alabama, jak i kilka innych, odbiera prawa wyborcze osobom w przeszłości skazanym.; My state of Alabama, like a number of states, actually permanently disenfranchises you if you have a criminal conviction.
9; 16; Turcja była przez lata opieszała, jeśli chodzi o ochronę praw mniejszości religijnych takich jak alawici czy chrześcijanie.; Turkey has been slow over the years to protect the rights of religious minorities, such as the Alawites and Christians.
10; 18; Tym razem podejście jest podobne, ponieważ używam, jak w produkcie Andrea, pewnych roślin.; This one is kind of the same approach because I include, in a product like Andrea, some plants.
11; 23; architektura sieci systemowych; Systems Network Architecture
12; 24; Serbia może i musi uczynić znacznie więcej, by ich aresztować.; Serbia can, and must, do a lot more to arrest them.
13; 30; Bandar Seri Begawan; Bandar Seri Begawan
14; 33; W związku z tym Bank Światowy mógłby działać jako partner krajów rozwijających się.; The World Bank could therefore act as a partner to the developing countries.
15; 35; A ujrzawszy Jezusa chodzącego, rzekł: Oto Baranek Boży!; and he looked upon Jesus as he walked, and saith, Behold, the Lamb of God!
16; 37; . ~~~ Pracowałem trochę w MICROSOFT nad dinozaurem Barney.; So the challenge was -- I worked for Microsoft for a little bit, working on the Microsoft Barney.
17; 38; Ten przerost możliwości stwarza problemy które Biały Dom nazywa katastroficznymi sukcesami.; So that overmatched capability creates problems -- catastrophic successes the White House calls them.
18; 39; Poważnie ucierpiała Bretania, region mojego kolegi i przyjaciela - pana posła Cadeca.; Brittany, the region of my colleague and friend, Mr Cadec, has been severely affected.
19; 41; Brian Crowley powiedział prezydentowi Klausowi, że Irlandczycy pragną traktatu lizbońskiego.; Brian Crowley said to President Klaus that the Irish wish for the Lisbon Treaty.
20; 42; Novo Nordisk Pharma Ltd Broadfield Park Brighton Road UK - RH11 9RT Crawley West Sussex Wielka Brytania; Novo Nordisk Pharma Ltd Broadfield Park Brighton Road UK- RH11 9RT Crawley West Sussex United Kingdom
21; 43; Suomi/ Finland OY BRISTOL- MYERS SQUIBB (FINLAND) AB Puh/ Tel: + 358 9 251 21 230; Suomi/ Finland OY BRISTOL-MYERS SQUIBB (FINLAND) AB Puh/ Tel: + 358 9 251 21 230
22; 44; A teraz spójrzmy na komputerowo wygenerowaną wersję Bruce`a, biegnącego w nowym środowisku.; And let's take a look at a computer-generated version of Bruce, running in a new environment.
23; 45; Singapurze, Malezji, Brunei, Filipinach, Wietnamie, Tajlandii, Indonezji, Sri Lance,; Singapore, Malaysia, Brunei, Philippines, Vietnam, Thailand, Indonesia,
24; 47; Uważam jednak, że taki wybór powinni mieć również moi współobywatele, Brytyjczycy.; However, I believe that that choice should also be given to my people, the British people.
25; 48; Jedna jest Brytyjką, kolejna Amerykanką, a ostatnia Kanadyjką.; One is a British, another is an American and the third is a Canadian.
26; 49; Brytyjskie Wyspy Dziewicze; British Virgin Islands
27; 50; Egis Pharmaceuticals Public Limited Company Kereszturi ut 30- 38 H- 1106 Budapeszt Węgry; Egis Pharmaceuticals Public Limited Company Kereszturi ut 30-38 H-1106 Budapest Hungary
28; 51; Pierwsze spotkanie z Mercosurem odbyło się w ubiegłym tygodniu w Buenos Aires.; The first meeting with Mercosur took place last week in Buenos Aires.
29; 52; Jest to bezspornie technologia wysokiego ryzyka, narażająca ludność na niebezpieczeństwo.; This is indisputably a high-risk technology which puts the population in danger.
30; 53; Zwalczanie terroryzmu jest bezsprzecznie wspólnym, oczywistym celem nas wszystkich.; Combating terrorism is unquestionably the common, self-evident aim of us all.
31; 55; Zadanie to wykonują publicznie i bezstronnie.; They must do so publicly and impartially.
32; 56; System sądowniczy w państwie prawa powinien być niezależny, ale też bezstronny.; A judicial system in a state under the rule of law should be independent but also impartial.
33; 57; I wszystko to stało się niemal bezszelestnie, spontanicznie, naturalnie.; And this has spread just frictionlessly, organically, naturally.
34; 59; Eesti Pank będzie wymieniać banknoty i monety korony estońskiej na euro bezterminowo i bez limitu kwoty.; Eesti Pank will exchange kroon banknotes and coins for euro in unlimited amounts and for an unlimited time.
35; 62; beztłuszczowa masa mięśniowa; lean muscle mass
36; 65; Przyzwoity, skuteczny, żadnego haju, całkowicie bezpieczny, bezwartościowy na czarnym rynku.; It was clean, efficient, there was no high, there was really no danger, it had no street value.
37; 66; To jeden ze sposobów walki z kryzysem gospodarczym, który możemy poprzeć bezwarunkowo.; This is one measure for combating the economic crisis which we can support unconditionally.
38; 67; Pojęcie rodziny zasługuje na nasz bezwarunkowy szacunek i ochronę.; The institution of the family merits unconditional respect and protection.
39; 71; W dziedzinie sportu biała księga pozostaje jedynym i najważniejszym punktem odniesienia.; In the area of sport, the White Paper remains the single most important reference point.
40; 72; Szybkoręki białas.; Fast hands for a white boy.
41; 73; CHAMPIX 0, 5 mg tabletki powlekane to białe tabletki o kształcie przypominającym; What CHAMPIX 0.5 mg and 1 mg film-coated tablets look like and contents of the pack
42; 74; Na dalekiej północy, przez ponad dziesięć tygodni lata trwają białe noce, podczas których słońce nie zachodzi.; In the far north, the White Nights, during which the sun does not set, last for around 10 weeks of the summer.
43; 75; Dokumentacja złożona w Holandii miała wyłącznie charakter bibliograficzny.; The dossier submitted to the Netherlands was only bibliographic.
44; 77; To był kiedyś mały market spożywczy sieci Food Lion, a teraz to jest biblioteka.; This was a little grocery store, a Food Lion grocery store, that is now a public library.
45; 78; Jeśli biblioteka jest wirtualna, dostęp do niej jest powszechny, gdyż nie istnieją fizycznie żadne drzwi, które zagradzają użytkownikom dostęp do informacji.; If a library is virtual its access is universal, because there is no physical door isolating information from its users.
46; 86; Więc unieście ręce jeszcze raz i napnijcie bicepsy.; So put your arms back up and flex your bicep.
47; 88; Właśnie o tym mówiłem przed chwilą, dziękując panu przewodniczącemu Daulowi, panu przewodniczącemu Schulzowi a także panu, kolego Brzezina, za zwrócenie uwagi.; Ladies and gentlemen, I was talking about this a moment ago, when I thanked Mr Daul and Mr Schulz. Thank you, too, Mr Březina, for drawing attention to this.
48; 89; Jeszcze jedna uwaga dotycząca finansowania: moim zdaniem, modulacja nie brzmi dobrze.; One more comment on financing: in my opinion, modulation is not a nice word.
49; 92; (RO) Nazwa Roşia Montană musi brzmieć coraz bardziej znajomo zarówno dla instytucji europejskich, jak i obywateli.; (RO) The name Roşia Montană must have an increasingly familiar ring for both European institutions and citizens.
50; 98; To podejście jest popierane także przez europejską organizację konsumencką BUC.; This approach is also supported by the European consumer organisation BUC.
51; 104; Miałem prowadzić debatę z Davidem Brinem, kiedy się pojawiłem, setka ludzi zaczęła mocno buczeć.; David Brin was going to debate me on this, and as I walked in, the crowd of a hundred started booing lustily.
52; 105; Ubikacje to dosłownie dziury w ziemi przykryte drewnianą budą.; The toilets there are literally holes in the ground covered with a wooden shack.
53; 108; I została córka Syońska jako chłodnik na winnicy, jako budka w ogrodzie ogórczanym, i jako miasto zburzone.; And the daughter of Zion is left as a booth in a vineyard, as a lodge in a garden of cucumbers, as a besieged city.
54; 110; Nie wiem ilu z was słyszało o RoboCup.; I don't know how many of you have heard about RoboCup.
55; 115; Centralny Urząd Planowania; Central Planning Office
56; 116; Centrum Nauki Kopernik; Copernicus Science Centre
57; 118; JABRA STONE2 - CES Innovation Award – Najlepsza innowacja, USA - Mobil Topkarakter, Dania; Jabra_STONE2 - CES Innovation Award - Best of Innovations, US - Mobil Topkarakter, Denmark
58; 119; Święte Cesarstwo Rzymskie Narodu Niemieckiego; Holy Roman Empire
59; 123; Od ponad dwudziestu lat wiemy, że ludność Południowego Sudanu nie chce prawa szariatu narzucanego przez Chartum.; on behalf of the ALDE Group. - (FR) Mr President, for over twenty years we have known that the population of Southern Sudan does not want Sharia law imposed by Khartoum.
60; 125; AstraZeneca UK Limited Alderley Park Macclesfield Cheshire SK10 4TG Wielka Brytania; AstraZeneca UK Limited Alderley Park Macclesfield Cheshire SK10 4TG United Kingdom
61; 126; Ostatnie wypadki w Chile i Nowej Zelandii nie pozwalają nam o tym zapomnieć.; The recent accidents in Chile and New Zealand will not allow us to forget this.
62; 127; Dlatego w tym roku (2009) Chiny staną się największym krajem angielskojęzycznym.; That's why this year China will become the world's largest English-speaking country.
63; 128; Chińska Republika Ludowa utrzymuje, że nie prowadzi ekspansji terytorialnej.; The People's Republic claims that it does not seek territorial expansion.
64; 129; Przywołajcie tę osobę w pamięci i w tym samym czasie śledźcie linię, drogę od B do E, a usłyszycie wszystko co Chopin miał do powiedzenia.; Bring that person into your mind, and at the same time follow the line all the way from B to E, and you'll hear everything that Chopin had to say.
65; 133; Dlatego właśnie UE i Czarnogóra podpisały układ o stabilizacji i stowarzyszeniu.; The EU and Montenegro therefore signed a Stabilisation and Association Agreement.
66; 134; Trzy czwarte obywateli Czech pragnie przeprowadzenia referendum w tej sprawie.; Three quarters of the citizens of the Czech Republic want a referendum on the subject.
67; 135; Novartis s. r. o Praha Nagano III U Nākladového Nādraží 10 130 00 Praha 3 Czechy; Novartis s. r. o Praha Nagano III U Nā kladového Nā draž í 10 130 00 Praha 3 Czech Republic
68; 136; Czego oczy nie widzą, tego sercu nie żal.; What the eye does not see, the heart does not grieve over.
69; 140; Czy mogę przyjąć zamówienie?; Can I take your order, please?
70; 141; Czy mówisz po polsku?; Do you speak Polish?
71; 142; Powstaje na skutek stopniowego rozkładu chrząstki wyściełającej zakończenia kości.; It results from the gradual breakdown of cartilage that cushions the ends of the bones.
72; 145; Czy chusta lub szal okrywający głowę są symbolem poddaństwa, posłuszeństwa czy oporu?; Is the hijab or the headscarf a symbol of submission or resistance?
73; 152; Który chodząc w pośrodku lwów stał się lwem, a nauczywszy się chwytać łupu pożerał i ludzi.; And he went up and down among the lions; he became a young lion, and he learned to catch the prey; he devoured men.
74; 153; chwytać kogoś za serce; to touch sb’s heartstrings
75; 154; Który chodząc w pośrodku lwów stał się lwem, a nauczywszy się chwytać łupu pożerał i ludzi.; And he went up and down among the lions; he became a young lion, and he learned to catch the prey; he devoured men.
76; 170; Podtrzymują one przekonanie, że cyberprzestrzeń nie jest obszarem bezprawia, ale podlega zasadom praworządności.; These uphold the belief that cyberspace is not a lawless area, but is subject to the rule of law.
77; 172; Kamerun, północny Kamerun, cykliczne fale głodu każdego roku od dziesięcioleci.; Cameroon, northern Cameroon, boom and bust cycles of hunger every year for decades.
78; 175; Zamorscy kupcy twoi dla wielkości wszelakich dostatków, srebrem, żelazem, cyną i ołowiem kupczyli na jarmarkach twoich.; Tarshish was thy merchant by reason of the multitude of all kinds of riches; with silver, iron, tin, and lead, they traded for thy wares.
79; 177; imbir/cynamon/kolendra; ginger/cinnamon/coriander
80; 180; Uważam, że procedura wzmocnionej współpracy została wykorzystana w cyniczny sposób.; I think the enhanced cooperation procedure has been used cynically.
81; 181; Cynizm polityczny brytyjskich liberalnych demokratów aż zapiera dech.; The political cynicism of the British Liberal Democrats is truly breathtaking.
82; 188; Narąbie sobie cedrów, i bierze cyprys i dąb, albo to, co jest najmocniejszego między drzewem leśnem, albo wsadzi jawór, który za deszczem odrasta;; He heweth him down cedars, and taketh the holm-tree and the oak, and strengtheneth for himself one among the trees of the forest: he planteth a fir-tree, and the rain doth nourish it.
83; 192; chudy jak patyk; as slim as a rake
84; 194; idź pan w chuj; get the fuck out of here
85; 198; Pomoże to w walce ze skutkami ubocznymi sportu zawodowego, takimi jak rasizm, doping i chuligaństwo.; This will help in the fight against the side-effects of professional sport, such as racism, doping and hooliganism.
86; 200; Proszek z przełamanej tabletki należy zetrzeć wilgotną chusteczką jednorazowego użytku, którą następnie należy wyrzucić.; Powder spilled from the broken tablet should be wiped up with a damp disposable towel which is thrown out.
87; 203; " Wystrzeliłem: "Chyba zwariowałeś.; I said, "Listen, it's insane.
88; 204; Nie wolno stosować leku CellCept w czasie ciąży, chyba że wyraźnie zaleci to lekarz.; You must not use CellCept during pregnancy unless clearly indicated by your doctor.
89; 211; cyfrowe wywołanie selektywne; Digital Selective Calling
90; 214; Należy również zauważyć, że te cyfry opowiadają tylko część całej historii.; What is also important is to note that these figures only tell part of the story.
91; 215; Gdyby pewien Cygan z Fehérvár mnie nie powstrzymał, to sięgnęłabym do pieca i wzięła kawałek.; If a Gipsy man from Fehérvár had not stopped me, I would have reached into the oven and taken out a piece.
92; 219; Aktywność insektów wskazuje, że umarła mniej więcej w tym samym czasie co DJ Mount.; Insect activity confirms she died around the same time DJ Mount did.
93; 229; DVD, jak wiecie, pojawiło się w połowie lat 90-tych i było dosyć drogie.; The DVD, as you know, was introduced in the mid-1990s and it was quite expensive.
94; 232; Prawie 100 osób straciło życie na Dominikanie, Haiti, Jamajce, Kajmanach oraz na Kubie, a tysiące innych straciło dach nad głową.; Nearly 100 people lost their lives in the Dominican Republic, Haiti, Jamaica, the Cayman Islands and Cuba, and thousands of others are now homeless.
95; 233; Doradztwo i pomoc sądowa dla dzieci i rodzin; Children and Family Court Advisory and Support Service
96; 235; - pytała Mary Douglas w eseju na temat ubóstwa napisanym 35 lat temu.; "What is the objective of the consumer?" Mary Douglas asked in an essay on poverty written 35 years ago.
97; 237; Oznacza to, że około 90 tysięcy osób straciło dach nad głową i zostało wysiedlonych.; This means that about 90 000 people became homeless and were displaced.
98; 242; Ma nowe dachówki. ~~~ A tu Rocinha i jest jeszcze lepiej.; And then you get Rocinha and you can see that it's getting even better.
99; 244; "Dobrze, a teraz, po przemówieniu na temat Przymierza Cywilizacji musimy wrócić na ziemię”.; 'Well, and now, following the Alliance of Civilisations, we must return to earth'.
100; 245; Było to dobrze ponad rok temu, dokładnie osiemnaście miesięcy temu.; This is well over a year, 18 months ago.
101; 246; A jeżeli firma Google nadal będzie dobrze prosperować, będzie to dowód, że nie ma konfliktu między zarabianiem pieniędzy a działaniem w wyważony i ludzki sposób.; And, if Google continues to prosper, it will prove that there is no inherent conflict between making money and acting in a sustainable and humane way.
102; 247; Z tego powodu każdy dokument, który przyjmujemy musi być dobrze przemyślany i wyważony.; For that reason, every document we adopt must be well thought out and well balanced.
103; 249; . ~~~ Nie zapomnijcie dobrze się bawić.; Which leads to the last topic: Do not forget to have fun.
104; 251; Ale żeby dobrze się spisać, mieć znaczący żywot potrzeba tych głębszych rzeczy, rzeczy na które nie mamy nawet słów.; What it really takes to do well, to lead a meaningful life, are things that are deeper, things we don't really even have words for.
105; 252; Więc nawet tu, Komisjo, musisz dobrze się zastanowić.; So even there, Commission, you must look before you leap.
106; 253; dobrze sobie radzić z; to have a way with
107; 254; Dobrze jest słyszeć o potrzebie różnorodności i wielojęzyczności, ale chciałabym pokrótce naświetlić sytuację w mojej części Wielkiej Brytanii.; Mr President, it is good to hear of the need for diversity and multilingualism, but I want to highlight very briefly a situation in my own part of the United Kingdom.
108; 256; To oczywiste, że nie będziemy w stanie dochować naszych obietnic, jeżeli nasza polityka nie będzie spójna.; It is obvious that we will not be able to keep our promises unless our policies are coherent.
109; 259; Ludność w potrzasku między obydwiema armiami może nie doczekać się zakończenia walk.; The people who are trapped between the two armies may not live to see the end of hostilities.
110; 263; Ale nie ma korzenia w sobie, lecz doczesny jest; a gdy przychodzi ucisk, albo prześladowanie dla słowa, wnet się gorszy.; yet hath he not root in himself, but endureth for a while; and when tribulation or persecution ariseth because of the word, straightway he stumbleth.
111; 264; Można się w nim doczytać absolutnie wszystkiego, czego sobie zażyczycie.; You can read absolutely anything you like into it.
112; 269; objętość infuzji (rozpuszczony preparat CANCIDAS dodany do 100 ml), stężenie końcowe; Reduced volume infusion (reconstituted CANCIDAS added to 100 ml) final concentration
113; 276; Nie może ona spaść na drugie miejsce w wyniku obecnych trudności gospodarczych.; It must not slip to number two as a result of the current economic difficulties.
114; 288; Po wygaśnięciu gwarancji produktu produkt osiąga koniec okresu eksploatacji (EOL).; After end of product warranty, the product reaches End of Life (EOL).
115; 289; Kilku moich kolegów konserwatystów z grupy EPP wyraziło w tej sprawie kilka uwag.; A couple of my Conservative EPP colleagues have made comments about this.
116; 290; Po pierwsze, EPS konsoliduje strategię opartą na partnerstwie i współpracy.; Firstly, the ENP consolidates a strategy based on partnership and cooperation.
117; 291; Wreszcie dysponujemy jasnym rozróżnieniem pomiędzy instrumentem poszerzającym Unię i ESP.; Now finally we have a clear distinction between the enlargement instrument and the ENP.
118; 292; Grecja nie jest jedynym krajem w EUW stojącym w obliczu poważnych problemów.; Greece is not the only country in EMU facing serious problems.
119; 295; Edward Albee „Die Ziege oder Wer ist Sylvia?“ („Koza albo Kim jest Sylwia?; Edward Albee “The Goat, or Who Is Sylvia?” 2004 Munich Volkstheater
120; 296; A pytanie brzmi: Czy w 2050 roku tak będą wyglądały miasta Edynburg, Londyn i Nowy Jork, czy może tak?; And the question is: Is that what Edinburgh and London and New York are going to look like in 2050, or is it going to be this?
121; 298; Via Emilia 21 IT- 27100 Pavia Włochy; Via Emilia 21 IT-27100 Pavia Italy
122; 299; Więc, ta kobieta to Emma, bloggerka naszego serwisu, TypePad.; So, this woman, her name was Emma, and she was a blogger on our service, TypePad.
123; 301; Piszę teraz nową książkę zatytułowaną "Epifania", opartą na serii wywiadów z ludźmi mówiącymi o tym, jak odkryli swój talent.; I'm doing a new book at the moment called "Epiphany," which is based on a series of interviews with people about how they discovered their talent.
124; 306; To Eryk Eldred, który drukuje nad Walden Pond prace Thoreau.; This is Eric Eldred making books at Walden Pond -- Thoreau's works.
125; 312; Naczynia krwionośne w naszych rękach niosą echo wodnych przepływów na Ziemi.; The blood veins in our hands echoed a course of water traces on the Earth.
126; 317; Kluczowe znaczenie ma skuteczna edukacja domowa i szkolna już od szkoły podstawowej.; Effective education in the home and in school from primary school up is paramount.
127; 318; Od dawna przekonuję, że edukacja przedszkolna i podstawowa jest niezwykle ważna dla rozwoju osobowego każdego dziecka.; I have long been an advocate of pre-school and primary education as essential for the personal development of every child.
128; 319; Navigation Path: Home &gt; The European Central Bank &gt; Dział edukacyjny &gt; Filmy; Navigation Path: Home &gt; The European Central Bank &gt; Educational &gt; Videos
129; 320; Po prostu kliknij najpierw rysunek, a następnie kliknij wyświetlony link Edycja.; Simply click first the drawing and then the Edit link that appears.
130; 321; Wszystkie edycje tabeli są dostępne w portalu Europa.; All editions of the scoreboard are available on the Europa website.
131; 322; Stwórzmy edytor tekstu, który jest tylko edytorem tekstu.; Let's create a word processor that's just a word processor.
132; 327; Sven, który jest obywatelem szwedzkim, wyjechał do Francji, aby eksplorować tamtejsze jaskinie.; Sven, a Swedish national, went to France to go spelunking.
133; 328; Tak więc w astronomii nastąpiła eksplozja nowych zasobów twórczych.; So here in astronomy, you have this vast explosion of new productive resources.
134; 329; W ostatnim pokoleniu naszego uprzemysłowionego świata widzimy eksplozję depresji klinicznej.; Clinical depression has exploded in the industrial world in the last generation.
135; 330; Więc oto eksponat numer 1.; So here's exhibit number one.
136; 332; Istnieje jednak możliwość przygotowania szczepionki, zawierającej wyselekcjonowany szczep wirusa grypy, na który nikt nie był dotychczas eksponowany, a więc nie doszło do immunizacji.; Instead, they can prepare a vaccine that contains a strain of flu virus specifically chosen because nobody has been exposed to it, and to which nobody is immune.
137; 333; Niektóre kraje posiadają znaczące rezerwy, których eksport nadal ograniczają.; Some countries have significant reserves which they continue to restrict to export.
138; 334; Europejscy eksporterzy nie powinni lekceważyć skali brazylijskiego rynku handlowego.; The scale of the Brazilian trade market for European exporters must not be underestimated.
139; 335; Ekspozycja na prolek wynosi poniżej 5 % w stosunku do aktywnego metabolitu.; Exposure to the pro-drug is less than 5 % relative to the active metabolite.
140; 338; Mamy więc ekspres do kawy, potrzeba tylko kilkuset rupii.; So this is a coffee machine. Just takes a few hundred rupees.
141; 339; Mamy więc ekspres do kawy, potrzeba tylko kilkuset rupii.; So this is a coffee machine. Just takes a few hundred rupees.
142; 340; Ekspresja receptora trombopoetyny zachodzi przeważnie na powierzchni komórek linii mieloidalnej.; The TPO receptor is predominantly expressed on the surface of cells of the myeloid lineage.
143; 341; Jedną z form sztuki przyciągającą uwagę agencji i przez to badaną, jest abstrakcyjny ekspresjonizm.; And one of the art forms that elicited the interest of the agency, and had thus come under question, is abstract expressionism.
144; 344; Większość donoszonych przypadków połączona była z wykonanymi zabiegami stomatologicznymi, jak ekstrakcja zęba.; The majority of reported cases have been associated with dental procedures such as tooth extraction.
145; 346; ekstrakt słodowy jęczmienia; barley malt extract
146; 348; Tym czerwonym krajom się nie udaje i potrzebna jest zmiana strategii, a nie upraszczająca ekstrapolacja.; These red are the countries that doesn't do it, and the policy has to be improved. ~~~ Not simplistic extrapolation.
147; 352; ~~~ „Statystyk-ekstrawertyk wpatruje się buty innej osoby.”; To which the answer is, "The extroverted statistician's the one who looks at the other person's shoes."
