148; 355; Wiemy, że dziś tu i ówdzie modne jest bycie ekstremistą lub populistą, lub nawet powiewanie flagami ksenofobii.; We know that it is now fashionable in some quarters to be extremist or populist, or indeed sometimes to wave the flags of xenophobia.
149; 356; Niektórzy ekstremiści wykorzystywali słabość państwa, aby odrzucać mniejszości.; Some extremists were using the weakness of the State to reject minorities.
150; 361; To jest ten głębszy powód, dlaczego ojcowie Kościoła i sobory nadały mu nazwę "ekumeniczny”.; This is the deeper reason that the Church Fathers and the Councils have given it the name 'Ecumenical'.
151; 363; Starała się pani unikać poruszania tych kwestii i dała pani popis ekwilibrystyczny.; You have tried to sidestep the issue and you have done a balancing act.
152; 371; Jednym z rozwiązań w tym impasie mogłaby być emisja obligacji rządowych na szczeblu UE.; One solution out of this deadlock could be to issue government bonds at EU level.
153; 372; W Irlandii, emisja dwutlenku węgla na jednego mieszkańca wynosi 17,5 ton rocznie.; Ireland's per capita carbon emission is 17.5 tonnes per annum.
154; 374; emisja promieni gamma; gamma ray emission
155; 375; Musimy drastycznie ograniczyć emisję dwutlenku węgla i stać się gospodarką niskoemisyjną.; We must reduce our CO2 emissions dramatically. We must become a low-carbon economy.
156; 376; Prospekt emisyjny papierów wartościowych (uprawnienia wykonawcze Komisji) (głosowanie); Prospectus on securities (implementing powers conferred on the Commission) (vote)
157; 377; Itr (90Y) to emiter czystego promieniowania beta.; Yttrium (90Y) is a beta pure emitter.
158; 378; Jaki rodzaj promieniowania jest emitowany?; What type of radiation do they emit?
159; 380; Banknoty takie może emitować Europejski Bank Centralny i krajowe banki centralne.; The European Central Bank and the national central banks may issue such notes.
160; 382; ~~~ To może być tylko stan, nie zaś przelotna emocja.; There might be storms, but the depth of the ocean is still there, unchanged.
161; 384; Ofiarowujesz pieniądze w jakiejś sprawie i stajesz się emocjonalnie związany z tą sprawą.; You donate money to a cause, and you become emotionally involved in that cause.
162; 385; W przeciwnym przypadku skutek dzisiejszego głosowania będzie wyłącznie emocjonalny.; Otherwise, the effect of today's voting will be no more than emotional.
163; 386; Jego osiągnięcie nie było tak trudne, jak w przypadku samochodów osobowych, ponieważ to nie jest aż tak emocjonujący temat.; It was not as difficult to achieve as in the case of cars, because this is not such an emotional subject.
164; 389; Roboty z charakterem mogą zasiać ziarno, z którego powstaną roboty z rzeczywistą empatią.; Character robotics could plant the seed for robots that actually have empathy.
165; 392; Jest to fakt empiryczny, który można udowodnić.; That is an empirical fact and one which can be proven.
166; 394; Pewnie usprawniłabym stary dom na mniej energochłonny. ~~~ W tym wypadku wyjdziemy na zero 20 latach.; Now, I probably would have upgraded the old house to be more energy-efficient, and in that case, it would take me more about 20 years to break even.
167; 402; Pragnę podziękować pani poseł McGuinness za informację o głosowaniu w Irlandii.; I would like to thank Mrs McGuinness for the information about voting day in Ireland.
168; 403; Wszystko jest dozwolone, dopóki nierentowny sektor bananów na wyspach, takich jak Gujana Francuska, Azory i Wyspy Kanaryjskie, jest chroniony.; Everything is permitted as long as the unprofitable banana industry on islands such as French Guiana, the Azores and the Canary Islands is protected.
169; 405; W przypadku Ameryki Środkowej jako regionu, kraj, w którym sytuacja jest najpoważniejsza to Gwatemala.; In the case of Central America, as a region, the country where the issue is most critical is Guatemala.
170; 406; Gwiazda Polarna jest środkiem przyrządu.; So the North Star corresponds to the center of the device.
171; 408; Gwinea Konakry potrzebuje wsparcia społeczności międzynarodowej.; Mr President, Guinea-Conakry needs the support of the international community.
172; 409; Kiedy opuściłam gabinet zadzwonił do mnie i powiedział: "Myślę, że nadszedł czas.; And as I left his office, he called me back and he said, "I think it's time.
173; 412; gabinet odnowy biologicznej; wellness and rejuvenation retreat
174; 419; I wtedy gniazdko musi być dość sprytne, by to zrobić.; Shut me off now, before I start a fire." And the power outlet needs to be smart enough to do it.
175; 421; Gnuśność jest dominującą cechą postaci.; Inertia has heroic status here.
176; 424; Jeżeli lek nie będzie zużyty w tym 4- tygodniowym okresie, należy go wyrzucić.; If the product is not used during this four-week period, it should be discarded.
177; 426; Pochodzę z kraju, w którym godność ludzka stanowi pierwszy artykuł konstytucji.; I come from a country in which human dignity is the first article of the constitution.
178; 428; Jest to - i chciałbym to podkreślić - godny pochwały przejaw powściągliwości.; This is - and I should like to emphasise this - a commendable show of restraint.
179; 436; Ich łączna grubość jest 600 razy mniejsza niż szerokość kropki.; The total width of it is 600 times smaller than the width of a decimal place.
180; 441; gruchać jak dwa gołąbki; to bill and coo
181; 444; Obawiam się, że może to być kolejny przypadek uproszczenia, kryminalizacji i dalszego prześladowania grupy poprzez zwykłe stwierdzenie, że jest to grupa terrorystyczna.; I fear that it is another case of simplification, criminalisation and continued persecution of a group by simply arguing that it is a terrorist group.
182; 446; Unigene UK Limited, 191 Sparrows Herne, Bushey Heath, Hertfordshire WD23 1AJ, Wlk.; Unigene UK Limited, 191 Sparrows Herne, Bushey Heath, Hertfordshire WD23 1AJ, UK
183; 447; Latvija Wyeth- Lederle Pharma GmbH Tãlr.: + 43 1 89 1140 Fakss: + 43 1 89 114600; Latvija Wyeth-Lederle Pharma GmbH Tãlr.: + 43 1 89 1140 Fakss: + 43 1 89 114600
184; 448; Nie można wykluczyć teoretycznego ryzyka występujące rzadko nadwrażliwości na rHA.; A theoretical risk of hypersensitivity to rHA at a low frequency cannot be ruled out.
185; 452; habit nie czyni mnicha; you shouldn’t judge a book by its cover
186; 454; Ale tkwi w tym pewien haczyk.; But we have a problem.
187; 463; Interakcja pomiędzy diltiazemem a atazanawirem zachodzi przez hamowanie CYP3A4.; The mechanism of diltiazem/ atazanavir interaction is CYP3A4 inhibition.
188; 464; A co, jeśli mimo naszych wysiłków duże spółki nadal będą hamować te zmiany?; What if, despite all our efforts, the big companies keep applying the brakes?
189; 466; Popieram wiedząc, że jest to swego rodzaju hamulec ekonomiczny i będzie kosztował 60 miliardów euro rocznie.; I support it, even knowing that it is a major step for our economy and will cost EUR 60 billion per year.
190; 477; SM: W Gateshead dziesięciolatka zgłębia hinduizm w 15 minut.; SM: Back at Gateshead, a 10-year-old girl gets into the heart of Hinduism in 15 minutes.
191; 479; Widać jak rozpręża się w trakcie uderzenia, praktycznie hiper-rozpręża.; You can actually see it extending over the course of the strike, and actually hyperextending.
192; 480; Hiperbola nie jest zbyt zaskakująca.; So the hyperbole is not actually surprising.
193; 482; Niezbyt często: zmniejszone łaknienie, cukrzyca, podwyższona aktywność amylazy, hipercholesterolemia.; Uncommon: decreased appetite, diabetes mellitus, hyperamylasaemia, hypercholesterolaemia.
194; 484; U pacjentów z niewydolnością nerek może wystąpić hipokalcemia lub hiperkalcemia.; Patients with renal insufficiency may develop hypocalcaemia or hypercalcaemia.
195; 490; Hipertekst jest nieprzestrzenny.; There were hypertext comics.
196; 491; Senność, zawroty głowy, parestezje, hipertonia Niezbyt często:; Somnolence, dizziness, paresthesia, hypertonia Uncommon:
197; 493; Znowu oddychałem przez minutę starając się hiperwentylować tak mocno jak się da i zaraz po tym wstrzymywałem oddech przez następne pięć i pół minuty.; Then I would breath again for a minute, purging as hard as I can, then immediately after that I would hold again for five and half minutes.
198; 494; W tym celu należy kliknąć hiperłącze EU Bookshop.; In order to view it, please follow the EU Bookshop link.
199; 499; Wielu Europejczyków ma wrażenie, że w kierunku południowych Włoch zmierza horda Tunezyjczyków.; Many Europeans are under the impression that a horde of Tunisians are heading for southern Italy.
200; 500; Aranesp działa dokładnie w taki sam sposób jak naturalny hormon – erytropoetyna.; Aranesp works in exactly the same way as the natural hormone erythropoietin.
201; 501; Hormony te są uwalniane po posiłku i stymulują trzustkę do wytwarzania insuliny.; These hormones are released after a meal and stimulate the pancreas to produce insulin.
202; 505; Z drugiej strony to horror, bo spędzasz w cholernym biurze jeszcze więcej czasu.; On the other hand, it's a nightmare -- it just means you spend more time at the bloody office.
203; 508; Spotkaliśmy się z nią, śmialiśmy się, płakaliśmy, wiedząc, że musi się znaleźć w hospicjum.; We took a look at her, we laughed, we cried, and we knew that she needed to be in a hospice.
204; 509; W przypadku (ciężkiego) przedawkowania wskazana jest hospitalizacja na oddziale intensywnej terapii.; In case of (severe) overdosage hospitalization in an intensive care department is indicated.
205; 510; Jednakże w przypadku przedawkowania, chorych należy hospitalizować w celu obserwacji oraz zastosować odpowiednie leczenie wspomagające.; However, in case of overdose, patients should be hospitalised for observation and appropriate supportive treatment given.
206; 512; Gdzie jest hostel?; Where is the youth hostel?
207; 515; Człowiek z hot-dog' ami w porcie.; The hot dog man in the harbor.
208; 522; Przemysł hrabstwa West Midlands z zadowoleniem przyjmie zasadę "Najpierw myśl na małą skalę”.; The West Midlands' industries will welcome the Think Small First principle.
209; 523; Hrabstwo Bertie jest dobrym przykładem schyłku wiejskiej części Ameryki.; Bertie County is kind of a prime example in the demise of rural America.
210; 525; Jest cudownym humorystą.; He's a wonderful humorist.
211; 529; Moglibyśmy wykrzyknąć "Hura dla demokracji, pomocniczości i odwagi cywilnej!”.; We could say "Hurrah! Democracy, subsidiarity and civil courage work.”
212; 532; Dzisiejsza mowa jest na temat mózgów i, hurra, mam gdzieś tutaj fana mózgów.; And today's talk is about brains and, yay, somewhere I have a brain fan out there.
213; 533; Nie możemy przyjąć tej metody hurtem, ponieważ wiąże się ona z dyskryminacją, ale musimy zbadać wszystkie możliwości, chroniąc jednocześnie prawa podstawowe.; We cannot adopt this method wholesale, because it involves discrimination, but we must investigate all the possibilities while protecting our fundamental rights.
214; 535; Dziś targ hurtowy mieści się we Frischezentrum, nowym kompleksie handlowym w dzielnicy Kalbach.; Today, the wholesale market is located in the Frischezentrum, a new complex in the district of Kalbach.
215; 541; Kryzys gospodarczy i finansowy wpływa i będzie nadal poważnie wpływał zarówno na przemysł hutniczy, jak i na przemysł stoczniowy.; (RO) Mr President, Commissioner, the economic and financial crisis has affected and will continue to seriously affect both the iron and steel and shipbuilding industries.
216; 546; Jest to hybryda z elektrycznym silnikiem metody unijnej oraz dieslem metody międzyrządowej.; It is a hybrid with an electric engine of Community method and a diesel engine of intergovernmental method.
217; 551; Wczorajszy "polski hydraulik” jutro będzie Chińczykiem lub Pakistańczykiem.; Yesterday's 'Polish plumber' will tomorrow be Chinese or Pakistani.
218; 553; Jego zdolności krasomówcze dały o sobie znać po raz pierwszy kiedy był w okręgu w Illinois.; His storytelling powers had first been recognized when he was on the circuit in Illinois.
219; 555; Islandia jest od roku 2010 państwem kandydującym do członkostwa w Unii Europejskiej.; Iceland has been a candidate country for European Union membership since 2010.
220; 557; Italia INFAI Italia S. r. l. via Borgogna 2 I- 20112 Milano Tel.: +39 0481 790350; Italia INFAI Italia S.r.l. via Borgogna 2 I-20112 Milano Tel.: +39 0481 790350
221; 560; Jednym z zagadnień, którymi się zajmowałem, było to, że identyczność jest zdecydowanie przereklamowana.; One of the strands of thinking I was involved in was that sameness is so incredibly overrated.
222; 561; Ponadto nadszedł czas, aby UE zajęła się również identyfikacją radiową (RFID).; It is also high time that the EU did something about 'radio-frequency identification'.
223; 563; W większości przypadków identyfikator kosztowałby więcej niż warte jest samo zwierzę.; Most of the time, in fact, the tag would actually cost more than the animal might even be worth.
224; 564; Flebogammadif 50 mg/ ml roztwór do infuzji Immunoglobulina ludzka normalna (IVIG); Flebogammadif 50 mg/ ml solution for infusion Human normal immunoglobulin (IVIg)
225; 565; Mogę zapewnić Parlament, że jesteśmy gotowi do współpracy i robimy wszystko, co możemy, aby inaugurować działalność tej międzyinstytucjonalnej grupy i wypracować wspólne podejście.; I can assure Parliament that we are very cooperative and we are doing everything we can to start this interinstitutional group and to work out a common approach as soon and as smoothly as possible.
226; 566; Kiedy chcesz ukradkiem przeglądać internet, Google Chrome oferuje tryb przeglądania incognito.; For times when you want to browse in stealth mode, Google Chrome offers the incognito browsing mode.
227; 567; Ten bolesny incydent jest między innymi rezultatem braku takiej informacji.; A costly incident has just occurred as a result of a failure to so notify.
228; 569; W swoim liście zapewnia on, że wydarzenia o których mówiłem miały charakter incydentalny.; In the letter, he gives his assurance that the events of which I have spoken were isolated incidents.
229; 570; Nasz indeks wyszukiwania stale ewoluuje, w miarę jak zmienia się zawartość internetu.; Our search index is constantly evolving as content is added and modified on the web.
230; 576; Zachowają swój indywidualizm w szerokim zakresie.; It will remain in very fundamental respects very different.
231; 577; indywidualne ubezpieczenie emerytalne; individual retirement plan
232; 578; Derek: Odkryliśmy taką indywidualność u różnych zwierząt, szczególnie u kotów.; DJ: Now we've found these individualisms in all sorts of animals, in particular in the cats.
233; 579; Nie są przyzwyczajeni do tego, aby występować jako indywiduum.; They aren’t used to putting themselves forward as individuals.
234; 580; Okazuje się, że inercja, która decyduje o ruchu kątowym, równa się R do potęgi piątej.; So it turns out, the inertia, which governs angular motion, scales as a fifth power of R.
235; 585; I jak doszłam do przekonania, że to co mi się zdarzyło jest wirusową infekcją memetyczną.; And how I've come to view what happened to me is a viral, memetic infection.
236; 589; Kiedy przemysł komputerowy rozwija interaktywność producenci TV wpadają na ten sam pomysł.; And of course, as the computer industry develops interactively, producers in the emerging TV business actually hit on the same idea.
237; 591; interfejs dysku twardego; hard disk interface
238; 592; interfejs kart pamięci komputerów osobistych; Personal Computer Memory Card Interface Adapter
239; 593; interfejs małych systemów komputerowych; Small Computer System Interface
240; 595; interfejs programistyczny Netscape'a; Netscape Application Programming Interface
241; 596; interfejs programistyczny serwerów internetowych; Internet Server Application Programming Interface
242; 597; interfejs stopnia podstawowego; Basic Rate Interface
243; 598; Interfejs użytkownika systemu kontrolującego może rozsuwać zasłony albo je zasuwać.; You know, from the user interface of the control system to opening curtains or closing curtains.
244; 599; interfejs użytkownika CUA; Common User Access
245; 601; Są trzy obszary, percepcja, obliczenia i interfejsy niewizualne.; So we have three steps. ~~~ We have perception, computation and non-visual interfaces.
246; 605; Pytanie o status quo ante również nie stanowi rozwiązania - należy iść dalej.; Asking for the status quo ante is not a solution either - one should move further.
247; 607; iść dalej prosto; to go straight on
248; 608; Nie - dzielimy się igłami, bo nie chcemy iść do więzienia."; We share needles because we don't want to go to jail."
249; 609; Jaką drogą mamy iść dalej? Dobrze byłoby mieć na tę sprawę jakiś pogląd.; The question is how we should move forward and I think it would be good to have a view.
250; 611; iść komuś źle; to do badly
251; 612; iść na całość; to go all the way
252; 615; iść na imprezę; to go to a party
253; 616; iść na koncert; to go to a concert
254; 619; Bezsporne jest to, że cylinder jest starszy niż tekst Izajasza, a jednak Jehowa przemawia w słowach podobnych do tych Marduka.; And it's quite clear the cylinder is older than the text of Isaiah, and yet, Jehovah is speaking in words very similar to those used by Marduk.
255; 620; Jezu ufam Tobie; Jesus, I trust in You
256; 621; Jezus Chrystus kochał zwierzęta: "Miłosierdzia chcę, a nie ofiary”, powiedział Zbawiciel.; Jesus Christ loved animals: 'I desire mercy, not sacrifice,' said the Saviour.
257; 622; Lata temu zostaliśmy skrytykowani, jak powiedział Jim Nicholson, za nadprodukcję żywności.; Years ago we were criticised, as Jim Nicholson said, for the over-production of food.
258; 625; Odpowiedział Jonatan Saulowi: Usilnie mię prosił Dawid, aby szedł do Betlehem;; And Jonathan answered Saul, David earnestly asked leave of me to go to Beth-lehem:
259; 626; To odpowiednik tego, jakbyście zatankowali auto w roku 1998, poczekali do 2011, i teraz możecie pojechać dwa razy na Jowisz tam i z powrotem.; That's the equivalent of you filling up your car with gas in 1998, waiting until 2011, and now you can drive to Jupiter and back twice.
260; 627; Juan Enriquez: Te eksperymenty czasem działają i jest naprawdę świetnie, kiedy nam się uda.; Juan Enriquez: These experiments sometimes work, and it's very cool when they do.
261; 628; Tedy rzekł jeden z uczniów jego, Judasz, syn Szymona, Iszkaryjot, który go miał wydać:; But Judas Iscariot, one of his disciples, that should betray him, saith,
262; 630; Dla przykładu, kiedy Juliusz Cezar przybił do Afryki Północnej, olbrzymie obszary tej części były porośnięte przez lasy cedrowe i cyprysowe.; So for instance, when Julius Caesar arrived in North Africa, huge areas of North Africa were covered in cedar and cypress forests.
263; 631; (Śmiech) Czy to dlatego, że jego imię to tak naprawdę Jupiter Blunck?; (Laughter) Is it because his name is really Jupiter Blunck?
264; 633; Zalecana całkowita dawka tygodniowa: między 75 a 300 j. m. / kg mc. drogą dożylną.; The recommended total weekly dose is between 75 and 300 IU/kg by the intravenous route.
265; 636; Ja osobiście jestem bardzo zaniepokojona wydarzeniami w stolicy mojego kraju.; I myself am very concerned at what is happening in the capital of my own country.
266; 637; I twierdzi… (Śmiech) Nie jak ja – ja projektuję gry, mam bujną wyobraźnię.; And he says ... (Laughter) Not like me -- I'm a game designer; I'm exuberant.
267; 640; Baranina i jagnięcina są bardzo zdrowym czerwonym mięsem.; Sheep meat and lamb meat is a very healthy red meat.
268; 642; Zaczarowane jagody, naturalny składnik zawierający specjalne właściwości.; And a miracle berry, if you're not familiar with it, is a natural ingredient, and it contains a special property.
269; 644; Dobra, 70 funciaków i Jaguar niech stracę.; I'll tell you what 70, quid and the Jag and I'm robbing myself.
270; 645; Nie stosować u kur niosek produkujących jaja przeznaczone do spożycia przez ludzi.; Not authorised for use in laying birds producing eggs for human consumption
271; 647; Kobiety, u których nie występuje jajeczkowanie i mają nieregularne miesiączki lub nie miesiączkują wcale.; Women who are not ovulating and are having irregular periods or no periods at all.
272; 649; Dla większości szczepów można uzyskać jedną, do dwóch dawek z jednego jajka.; For most strains, you could get one to two doses of vaccine per egg.
273; 654; W przeciwie stwie do tego modelu zwierz cego, ludzki jajnik po menopauzie jest wzgl dnie niewra liwy na stymulacj przez hormony płciowe.; In contrast to the highly responsive ovaries in this rodent model, the human ovary after menopause is relatively unresponsive to reproductive hormonal stimulation.
274; 655; pęcherzyk jajnikowy pierwotny; ovarian primary follicle
275; 667; Azaż jaskinią łotrowską jest dom ten przed oczyma waszemi, który nazwany jest od imienia mego?; Is this house, which is called by my name, become a den of robbers in your eyes?
276; 668; Sven, który jest obywatelem szwedzkim, wyjechał do Francji, aby eksplorować tamtejsze jaskinie.; Sven, a Swedish national, went to France to go spelunking.
277; 669; U pacjentów z nadciśnieniem ocznym lub jaskrą, wartość ta przekracza zazwyczaj 21 mmHg.; In a patient with ocular hypertension or glaucoma, the value is generally higher than 21 mmHg.
278; 671; Jedyne, co z nim zrobiono, to je na nowo pomalowano na jaskrawy kolor, otwarto delikatesowy sklep spożywczy i zrobiono restaurację w dawnej poczcie.; Really all they did was they gave it a fresh coat of bright paint, a gourmet grocery, and they put up a restaurant in the old post office.
279; 672; Można było zobaczyć np. obsydian i jaspis pokonujące ogromne odległości w Etiopii.; And the earliest evidence for it crops up somewhere between 80 and 120,000 years ago in Africa, when you see obsidian and jasper and other things moving long distances in Ethiopia.
280; 674; Izali według twego rozumu lata jastrząb, i rozciąga skrzydła swe ku południowi?; From thence she spieth out the prey; Her eyes behold it afar off.
281; 677; Głowę padalcową ssać będzie; zabije go język jaszczurczy.; He shall suck the poison of asps: The viper's tongue shall slay him.
282; 681; Rzekli mu uczniowie jego: Oto teraz jawnie mówisz, a żadnej przypowieści nie powiadasz;; His disciples say, Lo, now speakest thou plainly, and speakest no dark saying.
283; 683; Odrzuciliśmy wówczas antyamerykanizm, zarówno ukryty, jak i jawny, cechujący niektórych posłów w tej Izbie.; We repudiated at the time the anti-Americanism, both latent and overt, that characterises some in this House.
284; 685; jesteś w tarapatach; you are in for it
285; 686; jeździć na deskorolce; to go skateboarding
286; 687; jeździć na koniu; to ride a horse
287; 689; Nasz model zakłada naukę matematyki w ten sam sposób, w jaki uczymy się wszystkiego innego, tak jak uczymy się jeździć na rowerze.; So our model is learn math the way you'd learn anything, like the way you would learn a bicycle.
288; 695; Podobnie należy zredukować dawki, jeżeli liczba płytek spada poniżej 25 x 109/ l.; Doses should be similarly reduced if the platelet count falls below 25 x 109/ l.
289; 696; A dlaczego jest to ważne z punktu widzenia techniki wyjaśni wam już Keith.; And I'm going to kick it to Keith to explain why that's important from a technical standpoint.
290; 697; . - (DE) Jeszcze niedawno Kenia była wakacyjnym rajem dla wielu ludzi.; in writing. - (DE) Until a short while ago Kenya was a holiday paradise for many people.
291; 698; Charlesa Kenny'ego, liczba ludzi umiejących czytać i pisać wzrosła z 25 do 80 w ciągu ostatnich 130 lat.; And Charles Kenny that global literacy has gone from 25 percent to over 80 percent in the last 130 years.
292; 699; Kevin Shangraw: Jesteśmy tam, by pomoc Irakijczykom -- i właśnie zabiliśmy jednego.; Kevin Shangraw: The Iraqi people are who we are there to help -- and we just killed one.
293; 702; Przecież w tym duchu byliśmy skłonni do zawarcia kompromisu w Kigali.; After all, in that spirit, we were quite willing to have a compromise coming from Kigali.
294; 703; Jutro Kijów spodziewa się setek tysięcy, a może nawet milionów ludzi.; Hundreds of thousands, perhaps millions, of people are expected to be in Kiev tomorrow.
295; 704; Pytanie, które chcę zadać, które wszyscy zamierzamy zadać brzmi: kim pan jest?; The question that I want to ask and that we are all going to ask is: who are you?
296; 705; Kim... kim ty jesteś?; Who -- who are you?
297; 706; Spotkanie Tymczasowego Komitetu Międzynarodowego Funduszu Walutowego w Kingston na Jamajce.; The Interim Committee of the International Monetary Fund meets in Kingston, Jamaica.
298; 707; Damien prowadzi hotel pod Kinszasą.; Damien runs a hotel outside of Kinshasa.
299; 708; Umowa WE/Kirgistan dotycząca niektórych aspektów przewozów lotniczych (głosowanie); EC-Kyrgyzstan Agreement on certain aspects of air services (vote)
300; 711; Koronna Służba Prokuratorska; Crown Prosecution Service
301; 713; Tylko państwa mogą być członkami Unii Europejskiej, a Kosowo stało się państwem.; Only states may be members of the European Union and Kosovo has become a state.
