444; 1048; Nie miałem stosunków seksualnych z tą kobietą, panną Lewinsky.; I did not have sexual relations with that woman, Miss Lewinsky.
445; 1051; Uważam, że muszę wspomnieć o poprawce 2, w której ostro krytykowany jest papież Benedykt XVI.; I feel I have to mention Amendment 2, which sharply criticises Pope Benedict XVI.
446; 1054; Umowa WE-Paragwaj dotycząca pewnych aspektów usług lotniczych (głosowanie); Agreement between the EC and Paraguay on certain aspects of air services (vote)
447; 1055; Park Narodowy Gór Stołowych; Stołowe Mountains National Park
448; 1057; To jest Partenon.; This is the Parthenon.
449; 1058; Pfizer Holding France 23- 25, Avenue Du Docteur Lannelongue 75014 Paryż Francja; Pfizer Holding France 23-25, Avenue Du Docteur Lannelongue 75014 Paris France
450; 1062; dumny jak paw; glowing with pride
451; 1063; Z tego względu w okresie leczenia lekiem Paxene należy zaprzestać karmienia piersią.; Therefore, breast-feeding should be discontinued for the duration of Paxene therapy.
452; 1064; Polacy nie są barbarzyńcami, nie akceptują kary śmierci.; Poles are not barbarians, they do not accept the death penalty.
453; 1067; Jeśli wystąpi nasilona senność i/ lub spłycenie oddechu, pacjent lub jego opiekun powinien natychmiast skontaktować się z lekarzem i zadzwonić na pogotowie ratunkowe.; If you become very sleepy or have slow and/ or shallow breathing, you or your carer should contact your doctor immediately and call for emergency help.
454; 1069; Na początku marca odwiedziłam pogranicze tunezyjsko-libijskie.; I visited the Tunisian-Libyan border at the beginning of March.
455; 1070; pogratulować komuś czegoś; to compliment sb on sth
456; 1071; To czyni z niej największy pogrom dziennikarzy w historii świata.; This makes it the greatest massacre of journalists in world history.
457; 1074; pogrozić komuś palcem; to wag one's finger at sb
458; 1078; Te systemy można zidentyfikować i pogrupować. ~~~ Te systemy można zidentyfikować i pogrupować.; And those systems could be identified, and they could be grouped together.
459; 1079; Uważam takie praktyki za okrutne pogwałcenie prawa człowieka do osobistej integralności.; I consider such practices to be atrocious violations of the human right to personal integrity.
460; 1083; krąży pogłoska, jakoby...; rumour has it that...
461; 1086; Substancje działające na OUN mogą pogłębiać depresję oddechową (patrz punkt 4. 5).; CNS active substances may worsen the respiratory depression (see section 4.5).
462; 1087; pogłębiać swoją wiedzę; to broaden one’s knowledge
463; 1088; Zjawisko to może jedynie się pogłębić, jeżeli odstępstwo zostanie utrzymane w mocy.; This phenomenon can only get worse if this derogation is maintained.
464; 1089; Potrzebuję wszelkich środków, aby go pohamować.; I need everything we have at my disposal in order to stop his movement.
465; 1094; Wybierz opcję „Informacje o firmie zawierają błędne dane” i poinformuj nas, która zasada została naruszona.; Choose ‘Listing contains wrong information’ and let us know which policy is being violated.
466; 1095; Czy na przebudzenie się Europy będziemy musieli czekać, aż stanie się coś poważnego?; Will we have to wait for something serious to happen first before Europe wakes up?
467; 1100; przechowywanie i przekazywanie głosu; voice store and forward
468; 1103; Przechowywać z dala od ognia.; Keep away from naked flame.
469; 1104; Wolność nie oznacza braku odpowiedzialności, a reklamy nie stanowią sposobu umożliwiającego każdemu przechwalanie się swoim produktem.; Freedom does not mean unaccountability, nor is advertising a ploy allowing anyone to show off their products.
470; 1105; przechwalać się znajomościami; to drop names
471; 1106; przechwalać się znajomościami; to drop names
472; 1108; Oznacza to, że władze celne mają tylko jedną szansę na kontrolę towarów i przechwycenie ewentualnych nielegalnych produktów.; This means that customs have one single opportunity to control goods and seize any illegal traffic.
473; 1111; To do ich służb granicznych należy przechwytywanie takich przesyłek i konfiskata ich na granicy.; It is up to their border services to seize such shipments and stop them at the border.
474; 1112; Choć nie jestem tak wybitnym prawnikiem jak pani poseł Wallis, to jednak jestem prawnikiem i wiem, że przechwytywać informacje można tylko w wyjątkowych okolicznościach.; While not a great lawyer like Mrs Wallis, I am a lawyer, and I know that you must only use interception exceptionally.
475; 1113; przechylać się do tyłu; to lean back
476; 1114; Przechylić lekko fiolkę, utrzymując koniec igły jak najbliżej dna fiolki.; Tilt the vial slightly and keep the needle in the lowest part of the vial.
477; 1116; STELARA zawiera substancję czynną ustekinumab – przeciwciało monoklonalne.; STELARA contains the active substance ustekinumab, a monoclonal antibody.
478; 1119; Wydaje się, że Unia Europejska tej ekspansji nie jest w stanie przeciwdziałać.; It looks as if the European Union is not in a position to counter this expansion.
479; 1120; Substancja czynna preparatu Mycograb, efungumab, to środek przeciwgrzybiczy.; The active substance in Mycograb, efungumab, is an antifungal agent.
480; 1122; Krew należy pobierać do uprzednio oziębionych probówek zawierających środek przeciwkrzepliwy, heparynę.; Blood must be collected into pre-chilled tubes containing heparin anticoagulant.
481; 1123; Więc po morderstwie Hyuk-joo poszedł do motelu... i obejrzał ' Całusy ' z Yeon-sim. to jest 4: 05!; So after killing han, Hyuk-joo went into the motel... and saw ' kisses ' with Yeon-sim thats 4: 05!
482; 1125; Wydaje mi się, że Paul Simon jest dziś na widowni, i on być może nie zdaje sobie z tego sprawy, ale napisał cała piosenkę o seksie wielorybów: "Slip-slidin' away.; I think Paul Simon is in the audience, and he has -- he may not realize it, but he wrote a song all about whale sex, "Slip-Slidin' Away."
483; 1128; Należy pamiętać, że drugi dostawca poczty e-mail musi obsługiwać uwierzytelnianie SMTP, aby możliwe było skorzystanie z tej opcji.; Your other email provider has to provide authenticated SMTP support for you to use this option.
484; 1131; I generalnie bierzemy siano i jabłka i robimy sos barbecue z tych dwóch rzeczy.; And basically we took hay and crab apples and made barbecue sauce out of those two ingredients.
485; 1132; Opowiedziałem o tym i podszedł do mnie taki pan z Turcji i powiedział: "Bardzo dobry spec od marketingu ten Fryderyk Wielki, ale nie tak dobry jak Ataturk".; I told this story and a gentleman from Turkey came up to me and said, "Very, very good marketer, Fredrick the Great. ~~~ But not a patch on Ataturk."
486; 1133; Szukaj również wszelkich luk związanych ze skryptami XSS (skrypty między witrynami) i wstawkami SQL.; Also check for any XSS (cross-site scripting) and SQL injection vulnerabilities.
487; 1134; SS: Rozmawia z innymi bonobo, na odległość, dalej niż my możemy słyszeć.; SS: He talks to other Bonobos at the lab, long-distance, farther than we can hear.
488; 1135; Wracając do czasów dzieciństwa – dorastałem w fabryce tofu w Seattle.; But looking way back, when I was a child -- you see, I grew up in a tofu factory in Seattle.
489; 1138; Średnie zmniejszenie stężenia DNA HBV względem wartości początkowych (log10 kopii/ ml)± SEM1, 2, 3; Mean HBV DNA reduction from baseline (log10 copies/ ml)± SEM1,2,3
490; 1139; RPA Senegal Zjednoczone Emiraty Arabskie Turcja; Qatar Saudi Arabia Senegal South Africa
491; 1141; Macedonia, Serbia i Czarnogóra zdecydowanie wybrały drogę w kierunku Unii Europejskiej.; Macedonia, Serbia and Montenegro have definitely taken the turning for the European Union.
492; 1142; Seria niefortunnych zdarzeń; A Series of Unfortunate Events
493; 1143; Serwis Informacyjno-Wyszukiwawczy Dow Jonesa; Dow Jones News/Retrieval Service
494; 1146; Sfederowane Stany Mikronezji; Federated States of Micronesia
495; 1147; Sheffield Hallam University; Sheffield Hallam University
496; 1149; St. Peter Port; St. Peter Port
497; 1150; spaść na cztery łapy; to fall on one's feet
498; 1152; spaść z piedestału; to fall off one’s pedestal
499; 1169; Możecie mieć mały predyktor, neuronalny symulator, fizyki naszego ciała i zmysłów.; You might have a little predictor, a neural simulator, of the physics of your body and your senses.
500; 1170; Synestezja to doświadczanie stymulacji jednego zmysłu przez inny zmysł, na przykład barwne słyszenie.; Now, synesthesia is the experience of a stimulus in once sense organ in another sense organ as well, such as colored hearing.
501; 1172; Synod ten nie może zostać zarejestrowany i nie ma podstawy prawnej.; This Synod cannot be registered and has no legal basis.
502; 1173; I bocian na powietrzu zna ustawione czasy swoje, i synogarlica, i żuraw, i jaskółka przestrzegają czasu przylecenia swego; ale lud mój nie zna sądu Pańskiego.; Yea, the stork in the heavens knoweth her appointed times; and the turtle-dove and the swallow and the crane observe the time of their coming; but my people know not the law of Jehovah.
503; 1178; Tbilisi jest odpowiedzialne za niezrozumiałą decyzję o podjęciu działań wojskowych.; Tbilisi is responsible for the incomprehensible decision to take military action.
504; 1179; Więc podobnie do przesłania TED, działają razem bo tylko tak można coś zmienić.; So in the spirit of TED they're doing things together because it makes a difference.
505; 1180; Naiwnością byłoby sądzenie, że Teheran nie będzie w stanie wywrzeć nacisku na Europę.; It would be naive to believe that Tehran would not be able to put pressure on Europe.
506; 1183; . ~~~ Tennessee Valley Authority było w kropce.; OK, so the Tennessee Valley Authority was in a little bit of a bind.
507; 1194; Turecka Republika Cypru Północnego; Turkish Republic of Northern Cyprus
508; 1195; Turkmenistan jest jednym z wymienionych przez sprawozdawcę krajów Azji Środkowej.; Turkmenistan is one of the Central Asian countries the rapporteur mentions.
509; 1196; Corso Vittorio Emanuele Ii, 72 10121 Turyn Włochy; Corso Vittorio Emanuele Ii, 72 10121 Torino Italy
510; 1199; Tablica rejestracyjna dwu- i trzykołowych pojazdów silnikowych (wersja skodyfikowana) (głosowanie); Rear registration plate of two or three-wheel motor vehicles (vote)
511; 1203; Terminowość spłaty ubezpieczonych depozytów może zatem zostać poprawiona.; The timely payout of insurer deposits can indeed be improved.
512; 1206; Co ciekawe, termodynamika mówi, że wydajność spalania nie przekroczy 20%.; But more interestingly, the thermodynamics of this say, you're never going to get more than 20 percent efficiency.
513; 1212; Ahmed Dogan był założycielem tej organizacji, za co został skazany i osadzony w więzieniu jako terrorysta.; Ahmed Dogan was the founder of that organisation, for which he was convicted and imprisoned as a terrorist.
514; 1213; Może się zdarzyć, że akt terrorystyczny spowoduje ogromny chaos.; It may be the case that a terrorist act causes a great deal of chaos.
515; 1214; Krytykuję terroryzowanie pokojowo nastawionego Tajwanu poprzez wykluczenie tego kraju z wszelkich organizacji międzynarodowych, w tym ze Światowej Organizacji Zdrowia.; I have criticised the bullying of peaceful Taiwan in excluding this country from all international organisations, including the World Health Organisation.
516; 1215; Z pewnością w UE przebywają "uśpieni” terroryści, którzy mogą w każdej chwili się uaktywnić.; We certainly have sleepers within the EU, who could become active at any time.
517; 1217; swobodnego przemieszczania się i przebywania na terytorium Państw Członkowskich,; the right to move and reside freely within the territory of the Member States;
518; 1218; terytorium zamorskie Wielkiej Brytanii; British Overseas Territory
519; 1224; *** stratyfikowany test log- rank według grupy Rai (etap I- II vs III- IV) **** według 4- kolorowego przepływu; *** log-rank test stratified by Rai group (Stage I-II **** by 4-colour flow
520; 1229; W moim mniemaniu bliskowschodni proces pokojowy przechodzi obecnie test wytrzymałości.; (SK) Mr President, the Middle East peace process is, in my opinion, going through an endurance test at the moment.
521; 1231; Sporo z nas zna treść ustawy o wolności informacji i sporo z nas zna z doświadczenia rozwiązanie funkcjonujące w USA.; Quite a few of us know the Freedom of Information Act, and quite a few of us have experience of the way in which things are done in the USA.
522; 1234; Ale jeźli przecię w złości trwać będziecie, tedy i wy, i król wasz poginiecie.; But if ye shall still do wickedly, ye shall be consumed, both ye and your king.
523; 1237; Eksperymentowaliśmy z typografią, z ilustracją, ze zdjęciami.; We were experimenting with type, with illustration, with photos.
524; 1240; Mówię o tym, gdyż tak typowo przebiega podróż Irlandczyków w ostatnich tygodniach.; I raise this because it is typical of the many journeys undertaken by Irish people in recent weeks.
525; 1242; Przypadek Qimondy to przypadek typowy w sytuacji obecnego globalnego kryzysu finansowego i gospodarczego.; Qimonda is a paradigm case in the current context of global financial and economic crisis.
526; 1245; Pochodzę z Polski, gdzie ponad 20 lat temu, w 1989 roku, tyrania ustąpiła miejsca demokracji.; I come from Poland where, over 20 years ago, in 1989, tyranny gave place to democracy.
527; 1247; tyrać jak wół; to have one’s nose to the grindstone
528; 1249; Może być bezobjawowa i reagować na leczenie tyroksyną, oraz ustępować po odstawieniu leku.; It may be asymptomatic and responds to treatment with thyroxine and resolves upon withdrawal of treatment.
529; 1250; . ~~~ Tyły centrum komunalnego w moim mieście, Saratoga Springs, New York.; (Laughter) This is it on a smaller scale: the back of the civic center in my town, Saratoga Springs, New York.
530; 1251; Nie jest to zatem kwestia fałszowania tzw. wyborów w większym stopniu niż zazwyczaj.; The issue, therefore, is not about rigging so-called elections more than usual.
531; 1252; Są jak tęcza.; It's like a rainbow.
532; 1254; W miejscu wstrzyknięcia może wystąpić rozlany obrzęk – tęgi lub miękki (o średnicy do 5 cm).; Swelling (max. diameter 5 cm) may occur, either as hard or soft swelling.
533; 1256; Amerykanie mówią: "Ach, to tępak.; And the Americans: "Ah, he's a knucklehead.
534; 1261; tęsknie za tobą; I miss you
535; 1263; Pociągnąć tłoczek tak, aby nabrać do strzykawki prawidłową dawkę (patrz rycina 5).; Pull the plunger to withdraw the correct dose into the syringe (see Figure 5).
536; 1264; Leki te działają poprzez rozszerzenie naczyń krwionośnych, ułatwiając sercu tłoczenie krwi.; These medicines work by widening your blood vessels making it easier for your heart to pump blood through them.
537; 1267; Kończyna atakująca może dźgać ostrym zakończeniem, lub tłuc piętą.; So, the smasher raptorial appendage can stab with a point at the end, or it can smash with the heel.
538; 1270; Środki te pokrywają składki Agencji na ubezpieczenie chorobowe.; This appropriation covers the Agency's sickness contributions.
539; 1272; Ostatnio musiałem wykupić ubezpieczenie na życie.; So I just recently had to buy life insurance.
540; 1273; Prawo UE gwarantuje minimalne ubezpieczenie od odpowiedzialności cywilnej.; EU law guarantees minimum liability coverage.
541; 1274; Celem rozporządzenia jest ustanowienie maksymalnie przejrzystych procedur, na podstawie których osoby ubezpieczone otrzymałyby świadczenia społeczne w sytuacji transgranicznej.; Its goal is to establish procedures, as clearly as possible, on the basis of which those insured persons who are in a cross-border situation will receive social benefits.
542; 1276; Prawdopodobnie jednak niektórzy ubezpieczyciele wezmą go pod uwagę, warto więc zapoznać się z różnymi ofertami.; It is likely that some insurers will consider your claims record though, so it is worth shopping around.
543; 1280; Nie dajmy się ubiec rozwojowi wypadków.; We must make sure that we do not get overtaken by events.
544; 1281; FYROM to kraj ubiegający się o przystąpienie do UE, a Albania to potencjalny kraj kandydujący.; The FYROM is a candidate for EU accession and Albania is a potential candidate.
545; 1282; O mikrokredyt mogą ubiegać sie firmy zatrudniające mniej niż 10 pracowników.; A micro-credit can be accessed by companies with fewer than 10 employees.
546; 1283; Jak ubiegać się o środki UE lub kto mógłby sfinansować Twoją działalność?; Don't know how to apply for EU funding or who could finance your business?
547; 1284; ., chciałbym ubiegać się o stanowisko...; I wish to apply for the post of…which you advertised in…on… .
548; 1293; układać się w logiczną całość; to fall into place
549; 1301; Uprawiane i produkowane w Afganistanie narkotyki trafiają na europejskie ulice.; Drugs grown and produced in Afghanistan find their way to the streets of Europe.
550; 1305; ulitować się nad; to have mercy on
551; 1308; Okazuje się się, że trudno jest dzisiaj uruchomić środki z Funduszu Solidarności.; Today, the financial resources of the Solidarity Fund seem difficult to implement.
552; 1309; Spróbuj ponownie uruchomić komputer.; Try restarting your computer.
553; 1310; Jedynie wówczas będziemy w stanie ponownie uruchomić również budżet europejski.; Only then will we also be able to relaunch the European budget.
554; 1313; urwać się z choinki; to be living on a different planet
555; 1314; urwać się z choinki; to be living on a different planet
556; 1316; urywać się z lekcji; to cut class
557; 1317; (Śmiech) Oto wielka premiera - pokażę wam urywek.; (Laughter) This is my unveiling, because I am going to show you a clip.
558; 1319; Można je urzeć każdej nocy, wzdłuż brzegów rzek.; You can see it every night along the river banks.
559; 1321; Polityka spójności po 2013 roku musi w dalszym ciągu urzeczywistniać tę wizję.; The cohesion policy after 2013 must continue to make this vision a reality.
560; 1322; Urzeczywistnienie rynku wewnętrznego usług pocztowych Wspólnoty (debata); Accomplishment of the internal market in Community postal services (debate)
561; 1323; Musimy zapewnić, by podstawowe prawa każdej osoby mogły się urzeczywistnić.; We need to ensure that the fundamental rights of each person can become a reality.
562; 1324; Niezwykle urzekający. ~~~ Nie tylko potrafi strzelać, prowadzić samochód – no wiecie, pije wino, w istocie jest tam troszkę wina – no i, oczywiście, zawsze nosi smoking.; Not only can he shoot, drive, drink -- you know, he drinks wine, there actually is a little wine in there -- and of course, always wears a tuxedo.
563; 1327; Zdecydowanie nie jest to niezależny urząd prezydenta mającego władzę wykonawczą.; It is certainly not a President and not with executive powers in its own right.
564; 1328; urząd ds. rejestracji spółek; Companies Registration Office
565; 1334; uzależniony od czegoś; addicted to sth
566; 1335; Należy uzależnić wszelką pomoc międzynarodową od demokratycznych zmian na Białorusi.; All international aid should be made dependent on democratic change in Belarus.
567; 1336; Takie opinie i wystąpienia mogą jedynie uzasadniać politykę Rosji i jej sił specjalnych.; Such views and talk can only support Russia's policies and its special forces.
568; 1337; Dlatego wniosek o 5-procentowy wzrost w przyszłym budżecie jest uzasadniony i konieczny.; The request for a 5% increase in the next budget is therefore just and necessary.
569; 1341; Dlatego musimy uzbroić się w inne instrumenty, aby bronić najbardziej poszkodowanych obywateli.; For this reason, we must arm ourselves with other instruments to defend the people who are hardest hit.
570; 1346; Nie bądźcież jako koń, albo jako muł, którzy rozumu nie mają, których gęby uzdą i wędzidłem kiełznać musisz, aby się na cię nie porywały.; Be ye not as the horse, or as the mule, which have no understanding; Whose trappings must be bit and bridle to hold them in, [Else] they will not come near unto thee.
571; 1347; Ten dom z ciastek granoli ma specjalny dach z Sun Chipsów, po to, by gromadzić wodę i ją uzdatniać.; And the granola house has a special Sun Chip roof to collect water and recycle it.
572; 1348; Język słowacki jest nauczany jako język uzupełniający, przez kilka godzin tygodniowo.; Slovak is taught as a supplementary language for a few hours each week.
573; 1349; Ma ona przedstawiać doskonałość, wzajemne uzupełnianie się i solidarność oraz symbolizować jedność Europy.; The flag is intended to represent perfection, complementarity and solidarity and to symbolise Europe's unity.
574; 1350; Będzie ona uzupełniać Radę ds. Energii, która również stanie się bardziej dynamiczna.; That will be complementary to the Energy Council, which we will re-energise as well.
575; 1353; Chciałbym jedynie krótko uzupełnić moją pierwszą wypowiedź.; (DA) Mr President, I would just like briefly to add something to my first speech.
576; 1357; Jeśli takiego zaświadczenia nie przedstawią, nikną ich szanse na uzyskanie pracy.; If they fail to produce such a certificate, their chances of obtaining work vanish.
577; 1358; Należy uzyskać od producenta szczegółowe instrukcje dotyczące sposobu użycia pomp.; Specific instructions for using the pumps must be obtained from the manufacturer.
578; 1361; Nie próbujemy jednostronnie uzyskiwać korzyści ze strategii dla Azji Środkowej.; We are not trying to profit unilaterally from a strategy for Central Asia.
579; 1364; Każdy, kto chce uścisnąć rękę wyciągniętą przez grupę PPE-DE, może zrobić to jutro.; Anyone who wants to grasp the outstretched hand of the PPE-DE Group can do so tomorrow.
580; 1365; Na zakończenie prezydencji należy uściślać pochwały, a uogólniać żale.; At the end of a presidency, one should be specific in one's compliments, but general in one's regrets.
581; 1366; Więc już teraz musimy uściślić przepisy, a dopiero potem wprowadzić lepszą kontrolę.; Right now, then, we have to tighten up the laws and then carry out better controls.
582; 1368; Dziś kiedy WNP mówi o różnorodności, tylko rosyjskie siły są obecne.; Today, as the CIS talks about diversity, only Russian troops are present.
583; 1371; Australijska Wielka Rafa Koralowa jest kolejnym przykładem sukcesu.; The Australian Great Barrier Reef is another success story.
584; 1373; I przyjdzie miecz na Egipt, a będzie wielka trwoga w ziemi Murzyńskiej, gdy polegną pobici w Egipcie, a zabiorą dostatki jego, i podwrócone będą grunty jego.; And a sword shall come upon Egypt, and anguish shall be in Ethiopia, when the slain shall fall in Egypt; and they shall take away her multitude, and her foundations shall be broken down.
585; 1374; Wielka Wojna Ojczyźniana; Great Patriotic War
586; 1377; Wielki Obłok Magellana; Large Magellanic Cloud
587; 1378; I np. odwołano takich ludzi z pracy jak Jacek Sobala, Anita Gargas, Jacek Karnowski czy Wojciech Leszczyński.; So, for example, such people as Jacek Sobala, Anita Gargas, Jacek Karnowski and Wojciech Leszczyński have lost their jobs.
588; 1379; Wojewódzki Ośrodek Ruchu Drogowego; voivodeship training centre for drivers
589; 1382; wjechać z impetem; to plough through
590; 1383; Wcale nie jest jasne, jak pracodawca ma oceniać pracę równej wartości i czy ma na przykład wkalkulować dostępność odpowiednio wykwalifikowanych kandydatów.; It is not at all clear how an employer is supposed to assess work of equivalent value, whether he is required, for example, to factor in the availability of suitably qualified applicants.
591; 1384; Wygenerowany zostanie otagowany link, który można skopiować i wkleić do reklamy.; A tagged link will be generated for you and you'll be able to copy and paste it to your ad.
592; 1385; Korzystając ze schowka internetowego, można kopiować i wklejać wykresy z arkusza kalkulacyjnego do dokumentu lub rysunku.; You can use the web clipboard to copy and paste charts from a spreadsheet into a document or drawing.
593; 1390; Jest to zawsze odpowiedzialnością lekarzy i nie powinniśmy tu wkraczać z przepisami.; It is always the doctors' responsibility and we should not regulate it here.
594; 1392; Sobotnie noce to najlepszy czas, żeby wkraść się do ich pokojów.; Saturday nights were the best for sneaking into girls ' rooms.
595; 1395; Z powodu zwiększonego ryzyka miejscowych odczynów, zwłaszcza większe dawki dożylne należy podawać tylko przez dużą żyłę lub wkłucie centralne.; Due to the increased risk of local reactions, higher intravenous doses in particular should only be administered via a large vein or a central line.
596; 1396; Wkłuć igłę na całą długość w skórę, tak jak to pokazywali lekarz lub pielęgniarka.; Put the needle fully into the skin as shown by your nurse or doctor.
597; 1399; wlec się noga za nogą; to drag one's heels
598; 1400; Będziemy mogli wlecieć w anatomię jego mózgu -- dosłownie wlecimy w jego ciało -- ale przede wszystkim, wejrzymy w jego umysł.; We will be able to fly into the anatomy of Peter's brain -- literally, fly into his body -- but more importantly, we can look into his mind.
599; 1402; Tygacil ma postać proszku, z którego sporządza się roztwór do infuzji (wlew dożylny).; Tygacil is a powder that is made up into a solution for infusion (drip into a vein).
